,Index,User,Text,Face acts
10011,C_fb0e8baa3c72429a96ff81f63b9310ec,0,Unfortunately no I can't. $100 or bust.,
10012,C_fb0e8baa3c72429a96ff81f63b9310ec,1,Will you be picking it up yourself?,
10013,C_fb0e8baa3c72429a96ff81f63b9310ec,0,"Yes, just give me the address and I can do that.",
10014,C_fb0e8baa3c72429a96ff81f63b9310ec,1,I only have a few hours available.,
10015,C_fb0e8baa3c72429a96ff81f63b9310ec,0,"Accept my offer, please.",
10016,C_fb0e8baa3c72429a96ff81f63b9310ec,1,We need to make sure we hash out all the details or our chat will not be accepted and we will have to start another chat.,
10017,C_fb0e8baa3c72429a96ff81f63b9310ec,1,"I'm sorry, I didn't understand that.",
10018,C_fb0e8baa3c72429a96ff81f63b9310ec,0,Sorry. what are the times you are available for pick-up?,
10019,C_fb0e8baa3c72429a96ff81f63b9310ec,1,Tomorrow 12-2. Can you come then?,
10020,C_fb0e8baa3c72429a96ff81f63b9310ec,0,I am off of work at 12. I can come straight away and pick it up and pay for the Table. Is that okay?,
10021,C_fb0e8baa3c72429a96ff81f63b9310ec,1,Great.,
10134,C_a0ae441e46274f6abe4e3335540ed08c,1,Welcome! I see you're interested in our property!,
10135,C_a0ae441e46274f6abe4e3335540ed08c,0,yes ia dog allowd,
10136,C_a0ae441e46274f6abe4e3335540ed08c,1,"Pets are welcome as long as they follow our size and breed restrictions. In addition, there is a pet deposit of $300 in addition to security deposit and a pet rent of $25/month.",
10137,C_a0ae441e46274f6abe4e3335540ed08c,0,do you need 1st  month and last rent also,
10138,C_a0ae441e46274f6abe4e3335540ed08c,1,"Security deposit is $500, but an additional deposit might be required based on credit score.",
10139,C_a0ae441e46274f6abe4e3335540ed08c,0,at this i can only pay about 1600 could you do that,
10140,C_a0ae441e46274f6abe4e3335540ed08c,1,"Unfortunately, that is not a reasonable offer for this area. How long of a lease were you considering?",
10141,C_a0ae441e46274f6abe4e3335540ed08c,0,6 month,
10142,C_a0ae441e46274f6abe4e3335540ed08c,1,"Hmmm, a longer lease would help us here. How about $2200 for a 16 month lease?",
10143,C_a0ae441e46274f6abe4e3335540ed08c,0,would you do 1800 for 24 month,
10144,C_a0ae441e46274f6abe4e3335540ed08c,1,"The lowest I could go would be $2000 for a 24 month lease, with a good credit check.",
10145,C_a0ae441e46274f6abe4e3335540ed08c,0,how bout 1900,
10146,C_a0ae441e46274f6abe4e3335540ed08c,1,"We could only do that if you agreed to an increased security deposit of $1000, I think.",
10147,C_a0ae441e46274f6abe4e3335540ed08c,0,how about 1900 a month wilth a securty of 800,
10148,C_a0ae441e46274f6abe4e3335540ed08c,1,"I can't agree to that, unfortunately. It'd have to be $1900 a month with a $1000 security deposit, for a 24 month lease.",
10149,C_a0ae441e46274f6abe4e3335540ed08c,0,deal,
10150,C_a15337bdce5746e8997053b50b9dcf2e,0,How old exactly is the phone? I am interested in it.,
10151,C_a15337bdce5746e8997053b50b9dcf2e,1,The phone is about two years old but has been welling taken care of.,
10152,C_a15337bdce5746e8997053b50b9dcf2e,0,Does all the accessories come with it as well?,
10153,C_a15337bdce5746e8997053b50b9dcf2e,1,"Yes, I do have all the accessories, manual, and box from when I purchased it.  I am hoping to sell this weekend.  Are you interested?",
10154,C_a15337bdce5746e8997053b50b9dcf2e,0,I am interested. It is 2 years old though. Would you be willing to come down in the price?,
10155,C_a15337bdce5746e8997053b50b9dcf2e,1,"The phone is like new, so I could come down a bit but not much.  I have several other interested parties.",
10156,C_a15337bdce5746e8997053b50b9dcf2e,0,"Yes, I understand. I have been looking at other listings as well. I could do $140 and I would pick it up today with cash in hand.",
10157,C_a15337bdce5746e8997053b50b9dcf2e,1,I can't go lower than $170.  Did I mention it does have an extended warranty that would give you warranty coverage for another full year.,
10158,C_a15337bdce5746e8997053b50b9dcf2e,0,Could you do $165?,
10159,C_a15337bdce5746e8997053b50b9dcf2e,1,"If you pick it up with cash today, I could do $165.",
10160,C_a15337bdce5746e8997053b50b9dcf2e,0,You got a deal!,
10315,C_a1d229c625f44fa583b45506c69c3b46,1,"Hello, this is my faithful and trusted Dodge Ram for the low price of $13000. I am relocating to another country so I am selling everything and I need every penny I can get.",
10316,C_a1d229c625f44fa583b45506c69c3b46,0,How many miles does it have?,
10317,C_a1d229c625f44fa583b45506c69c3b46,1,"The  mileage is 100,000",
10318,C_a1d229c625f44fa583b45506c69c3b46,0,Does it need any repairs?,
10319,C_a1d229c625f44fa583b45506c69c3b46,1,No it does not. I just had work done on it and everything runs smoothly. I am and have been the sole owner of the truck. I have had no accidents and it is very sturdy and reliable. If I was not relocating to another country I would not sell it.,
10320,C_a1d229c625f44fa583b45506c69c3b46,0,Are you smoker? I'm allergic to cigarette smoke.,
10321,C_a1d229c625f44fa583b45506c69c3b46,1,"You don't have to worry, I have never smoked a day in my life. The interior is perfect.",
10322,C_a1d229c625f44fa583b45506c69c3b46,0,Great. Would you accept $7000 for it?,
10323,C_a1d229c625f44fa583b45506c69c3b46,1,"That is really low. Please remember that I am relocating, I have a ton of expenses. This is a Dodge and it is in tip top condition. Give me $12000",
10324,C_a1d229c625f44fa583b45506c69c3b46,0,"$11,500?",
10325,C_a1d229c625f44fa583b45506c69c3b46,1,You have a deal,
10326,C_a1d229c625f44fa583b45506c69c3b46,0,Great.,
10327,C_bc3435c39a8640b88e58a2428416719c,1,You interested in buying my BMX?,
10328,C_bc3435c39a8640b88e58a2428416719c,0,"Yea, I love it! It looks amazing!",
10329,C_bc3435c39a8640b88e58a2428416719c,1,Any questions about it you want to know?,
10330,C_bc3435c39a8640b88e58a2428416719c,0,"Yea, is it new?",
10331,C_bc3435c39a8640b88e58a2428416719c,1,It is not new but it is in great condition no marks or anything,
10332,C_bc3435c39a8640b88e58a2428416719c,0,"Wow, great! how much would  you like for it?",
10333,C_bc3435c39a8640b88e58a2428416719c,1,I am selling it for $10,
10334,C_bc3435c39a8640b88e58a2428416719c,0,"Thats not bad at all, but  its a little old. Could we do 6 and I will pick it up and pay cash.",
10335,C_bc3435c39a8640b88e58a2428416719c,1,Yes send your  offer I will accept,
10336,C_bc3435c39a8640b88e58a2428416719c,0,Sure! Does anything else come with it?,
10337,C_bc3435c39a8640b88e58a2428416719c,1,Just the B.M.X is all that comes with it.,
10338,C_bc3435c39a8640b88e58a2428416719c,0,Thats still not bad. When can I pick it up?,
10339,C_bc3435c39a8640b88e58a2428416719c,1,You can pick up today I will be home all day,
10340,C_bc3435c39a8640b88e58a2428416719c,0,"Okay, great!",
10353,C_e0d2f847d8794e60be5cb3ec58af43d3,0,"Hi, I'm interested in your Motorola?",
10354,C_e0d2f847d8794e60be5cb3ec58af43d3,1,"It's a great phone, very slightly used",
10355,C_e0d2f847d8794e60be5cb3ec58af43d3,0,"Any scratches, dents? Cracked screen?",
10356,C_e0d2f847d8794e60be5cb3ec58af43d3,1,No scratches at all anywhere. It's also compatible with all major carrier. It's a great deal I can assure you,
10357,C_e0d2f847d8794e60be5cb3ec58af43d3,0,$120 is a little high. Does it come with any peripherals? A case?,
10358,C_e0d2f847d8794e60be5cb3ec58af43d3,1,I can give you my previous case that fits perfectly! And a pair of earbuds if you're really interested.,
10359,C_e0d2f847d8794e60be5cb3ec58af43d3,0,A case would be great. I assume it comes with the charger as well?,
10360,C_e0d2f847d8794e60be5cb3ec58af43d3,1,Yes of course. I am telling you 120$ is not much for this phone!,
10361,C_e0d2f847d8794e60be5cb3ec58af43d3,0,"Can we do $100 for the phone w/charger and the case? Thanks but no thanks on the earbuds, I'm a bit of a germaphobe.",
10362,C_e0d2f847d8794e60be5cb3ec58af43d3,1,"Yes, but you have to pick it up if tht's ok with you.",
10363,C_e0d2f847d8794e60be5cb3ec58af43d3,0,That would work great for me!,
10364,C_3d207a3e2f5b43ca99023e9b3c8d9268,0,Hello,
10365,C_3d207a3e2f5b43ca99023e9b3c8d9268,1,hello hello. are you interested in this place?,
10366,C_3d207a3e2f5b43ca99023e9b3c8d9268,0,Yes I am. Is it in a nice area?,
10367,C_3d207a3e2f5b43ca99023e9b3c8d9268,1,this is a good area. there are cool little shops and a park very close by,
10368,C_3d207a3e2f5b43ca99023e9b3c8d9268,0,awesome news. Can I come by and take a look at the place?,
10369,C_3d207a3e2f5b43ca99023e9b3c8d9268,1,please come by and take a look. i am asking 1588,
10370,C_3d207a3e2f5b43ca99023e9b3c8d9268,0,Can you come down on the price a bit?,
10371,C_3d207a3e2f5b43ca99023e9b3c8d9268,1,well what did you have in mind?,
10372,C_3d207a3e2f5b43ca99023e9b3c8d9268,0,I was hoping to pay 1100 for it? Would that be alright?,
10373,C_3d207a3e2f5b43ca99023e9b3c8d9268,1,that is a little bit too low. can you do 1500. you will love this place,
10374,C_3d207a3e2f5b43ca99023e9b3c8d9268,0,I can do that. I will be by tomorrow to take a look. It is a deal.,
10375,C_3d207a3e2f5b43ca99023e9b3c8d9268,1,"ok grea, see you then",
10376,C_4c87e5e8b80b41d99280f9309b3eeeb7,0,Hi there. I would like more information on the Black sofa.,
10377,C_4c87e5e8b80b41d99280f9309b3eeeb7,1,hi would you like to buy the sofe set been use some,
10378,C_4c87e5e8b80b41d99280f9309b3eeeb7,0,"I am interested,but need some more information. Is there any stains or spills on it? Any tears or rips?",
10379,C_4c87e5e8b80b41d99280f9309b3eeeb7,1,i paid 3500 for them about 5 years ago i got 2 kids and 2 dog so there is some tears and spot,
10380,C_4c87e5e8b80b41d99280f9309b3eeeb7,0,"Okay, I would need to get it cleaned and repaired(if possible). Are you willing to come down on the price some considering I would have additional expenses to get it repaired and cleaned.",
10381,C_4c87e5e8b80b41d99280f9309b3eeeb7,1,there a tear in the front  and the side  one dont go all the way back    i would take less,
10382,C_4c87e5e8b80b41d99280f9309b3eeeb7,0,Would you do $1250?,
10383,C_4c87e5e8b80b41d99280f9309b3eeeb7,1,i would do 1350 if you could come   today,
10384,C_4c87e5e8b80b41d99280f9309b3eeeb7,0,How about $1300 and I could be there within the hour to get it.,
10385,C_4c87e5e8b80b41d99280f9309b3eeeb7,1,my husband is saying no less then 1325 aorry,
10386,C_4c87e5e8b80b41d99280f9309b3eeeb7,0,I will do $1325,
10387,C_4c87e5e8b80b41d99280f9309b3eeeb7,1,deal,
10425,C_a28155c8e949466f8d4bfeaa104f185f,0,"HI, is this real leather?",
10426,C_a28155c8e949466f8d4bfeaa104f185f,1,"Yes, real leather.",
10427,C_a28155c8e949466f8d4bfeaa104f185f,0,How long have you had it?,
10428,C_a28155c8e949466f8d4bfeaa104f185f,1,"I have had it for about a year, but it is in great condition.",
10429,C_a28155c8e949466f8d4bfeaa104f185f,0,Why are you selling it?,
10430,C_a28155c8e949466f8d4bfeaa104f185f,1,I just do not need it anymore. I am moving and need something smaller.,
10431,C_a28155c8e949466f8d4bfeaa104f185f,0,Makes sense. Are there any stains on the fabric?,
10432,C_a28155c8e949466f8d4bfeaa104f185f,1,"None at all, no.",
10433,C_a28155c8e949466f8d4bfeaa104f185f,0,"Would you happen to know what type of fabric that is, and has it been treated to repel stains?",
10434,C_a28155c8e949466f8d4bfeaa104f185f,1,"I'm actually not sure, but it has a removable cushion and washable cover.",
10435,C_a28155c8e949466f8d4bfeaa104f185f,0,Ok. Is there anyway I could get the couch for $301?,
10436,C_a28155c8e949466f8d4bfeaa104f185f,1,I have it listed for 430. I'm gonna need at least 400. Sorry,
10437,C_a28155c8e949466f8d4bfeaa104f185f,0,It's just that I also need to rent a truck to pick it up so the $301 would make that feasible for me.,
10438,C_a28155c8e949466f8d4bfeaa104f185f,1,"Oh okay, well what If I bring it to you?",
10439,C_a28155c8e949466f8d4bfeaa104f185f,0,That would work. I could pay the $400 if you could deliver it.,
10440,C_a28155c8e949466f8d4bfeaa104f185f,1,That sounds great! We have a deal!,
10441,C_a28155c8e949466f8d4bfeaa104f185f,0,Great. Thanks for being so willing to work with men.,
10442,C_a28155c8e949466f8d4bfeaa104f185f,1,You still want me to bring them to you?,
10443,C_a28155c8e949466f8d4bfeaa104f185f,0,"Yes, I can do 400 if you can deliver it.",
10444,C_a28155c8e949466f8d4bfeaa104f185f,1,Sure! Deal!,
10607,C_54688ef83a4243ef9624898d9039f630,1,Hello,
10608,C_54688ef83a4243ef9624898d9039f630,0,Hello I am interested in your service. Am i able to call or text?,
10609,C_54688ef83a4243ef9624898d9039f630,1,Sure you can. What questions do you have about this service?,
10610,C_54688ef83a4243ef9624898d9039f630,0,What are your hours?,
10611,C_54688ef83a4243ef9624898d9039f630,1,We are here from 11am to 7:30 pm every single day.,
10612,C_54688ef83a4243ef9624898d9039f630,0,Would you take $30 for the service,
10613,C_54688ef83a4243ef9624898d9039f630,1,30 dollars is a little too low. How bout we meet in the middle at 40 dollars?,
10614,C_54688ef83a4243ef9624898d9039f630,0,how about 35?,
10615,C_54688ef83a4243ef9624898d9039f630,1,35 can work. Wanna come by the store and learn more about it?,
10616,C_54688ef83a4243ef9624898d9039f630,0,Yes!  Thank you!,
10617,C_54688ef83a4243ef9624898d9039f630,1,"Alright, sounds good.",
10721,C_05150d717e1e40faab477cd9311c5b46,1,Hey,
10722,C_05150d717e1e40faab477cd9311c5b46,0,Hello. I am interested in your mirror,
10723,C_05150d717e1e40faab477cd9311c5b46,1,It is a great mirror. I used it on the mantel to reflect Christmas lights during the holidays.,
10724,C_05150d717e1e40faab477cd9311c5b46,0,sounds really nice. Does it have any scratches? is it in good condition?,
10725,C_05150d717e1e40faab477cd9311c5b46,1,No scratches and in great condition.,
10726,C_05150d717e1e40faab477cd9311c5b46,0,ok I would be willing to pay $35 for it and I will come over and pick it up later this evening,
10727,C_05150d717e1e40faab477cd9311c5b46,1,That is perfect.  I know you will enjoy it.,
10728,C_05150d717e1e40faab477cd9311c5b46,0,so we have a deal at 35? I will be over later,
10729,C_05150d717e1e40faab477cd9311c5b46,1,Yes we have a deal,
10730,C_05150d717e1e40faab477cd9311c5b46,0,great,
10753,C_5a82918d43894f379a82e2abdb216899,1,Hi. Are you interested in the car?,
10754,C_5a82918d43894f379a82e2abdb216899,0,Yes I really like it. does it have alot of miles on it? how is the condition?,
10755,C_5a82918d43894f379a82e2abdb216899,1,"It's in great condition, and I've had stuff replaced, so it has mostly new parts. All the paperwork has been prepared by and it has been inspected within the last month.",
10756,C_5a82918d43894f379a82e2abdb216899,0,thats good to hear. it seems like it has been around the block and has high mileage so I am willing to offer $5500 for it,
10757,C_5a82918d43894f379a82e2abdb216899,1,5500 is too low. I need a serious offer. Sorry. I can drop it to $7500.,
10758,C_5a82918d43894f379a82e2abdb216899,0,Don't mean to be so cheap. I would be willing to come up to $7000,
10759,C_5a82918d43894f379a82e2abdb216899,1,$7200 and I'll pay off all taxes and the license,
10760,C_5a82918d43894f379a82e2abdb216899,0,"thats sound like a good deal, I'll do $7200 and will come pick it up",
10761,C_5a82918d43894f379a82e2abdb216899,1,"Sure, sounds like a deal",
10762,C_5a82918d43894f379a82e2abdb216899,0,great,
10957,C_d94a3f34a3cd4a26a1e5a896bebabb0f,0,hI,
10958,C_d94a3f34a3cd4a26a1e5a896bebabb0f,1,"Hey, how's it going?  This is an awesome bike which I've put a lot of work into and I'm a BIKE EXPERT",
10959,C_d94a3f34a3cd4a26a1e5a896bebabb0f,0,Oh great I am interested...,
10960,C_d94a3f34a3cd4a26a1e5a896bebabb0f,1,"The list price is $100 and I actually think that's reallllly fair.  A bargain, even !",
10961,C_d94a3f34a3cd4a26a1e5a896bebabb0f,0,I am 5'7'' is this an appropriate size bike for me?,
10962,C_d94a3f34a3cd4a26a1e5a896bebabb0f,1,"Yes!  I would estimate this bike is perfect for anyone 5'2"" to 6'11""",
10963,C_d94a3f34a3cd4a26a1e5a896bebabb0f,0,great. i am little nervous that you repaired it yourself. Is there any guarentee for it?,
10964,C_d94a3f34a3cd4a26a1e5a896bebabb0f,1,"Sure, we can set up a contract guaranteeing it works perfectly for 30 days, otherwise I will return your money to you",
10965,C_d94a3f34a3cd4a26a1e5a896bebabb0f,0,Any wiggle room in the price I was hoping to pay closer to $50.,
10966,C_d94a3f34a3cd4a26a1e5a896bebabb0f,1,"Yikes, that's way lower than what I'm shooting for.  I can go down to $90, but that's really it.",
10967,C_d94a3f34a3cd4a26a1e5a896bebabb0f,0,"could you do 80 , If I pick it up?",
10968,C_d94a3f34a3cd4a26a1e5a896bebabb0f,1,"Uh, you're going to pick it up regardless, I can't really lug it around in my Smart Car.  And no, I really don't want to move below $90, sorry.",
10969,C_d94a3f34a3cd4a26a1e5a896bebabb0f,0,fine I guess 90 and a moneyback offer works,
10993,C_34ab8521e1b74938b07d1ca75d50ed24,0,Hi there!,
10994,C_34ab8521e1b74938b07d1ca75d50ed24,1,"Hello, how are you today?",
10995,C_34ab8521e1b74938b07d1ca75d50ed24,0,Good! I am interested in your car. Any issues with the car?,
10996,C_34ab8521e1b74938b07d1ca75d50ed24,1,No issues at all. It runs and drives great and has a clean title.,
10997,C_34ab8521e1b74938b07d1ca75d50ed24,0,the interior is leather?,
10998,C_34ab8521e1b74938b07d1ca75d50ed24,1,"Yes, it comes with leather seats, has front seat heaters, and a sunroof",
10999,C_34ab8521e1b74938b07d1ca75d50ed24,0,Sounds nice. can you go down a bit? How about $2500?,
11000,C_34ab8521e1b74938b07d1ca75d50ed24,1,"That is a little too far down to me. I am asking 5300 for it and that is over 50% off from my asking price. I can give you a little more info about the car so you can see how valuable it actually is... It has 4WD/AWD, automatic trans, BOSE sound system and more..",
11001,C_34ab8521e1b74938b07d1ca75d50ed24,0,Yes. The money a little tight here. How about 3800 all cash?,
11002,C_34ab8521e1b74938b07d1ca75d50ed24,1,"What if we meet at $4,200?",
11003,C_34ab8521e1b74938b07d1ca75d50ed24,0,4000 and I'll pick it up,
11004,C_34ab8521e1b74938b07d1ca75d50ed24,1,"$4,100 and you have a deal",
11005,C_34ab8521e1b74938b07d1ca75d50ed24,0,deal!,
11006,C_17458bff694d4e23b830246b3315ac31,1,Hey were you interested in the studio?,
11007,C_17458bff694d4e23b830246b3315ac31,0,Hello. I'm interested in the studio you have listed.,
11008,C_17458bff694d4e23b830246b3315ac31,1,Awesome. It's good sized for a studio. Did you have any questions about the amenities?,
11009,C_17458bff694d4e23b830246b3315ac31,0,"Yes, I was just about to ask. Which amenities are included.",
11010,C_17458bff694d4e23b830246b3315ac31,1,For most all my listing in the area I throw in parking. The laundry room is very close. I also cover everything besides electricity as far as utilities go.,
11011,C_17458bff694d4e23b830246b3315ac31,0,"Excellent. It's just what I'm looking for. The only thing is, I'm a little tight on money right now, and I have been looking at a few other properties. I'm looking to pay closer to $812, but I'm willing to negotiate on the price.",
11012,C_17458bff694d4e23b830246b3315ac31,1,You seem like an honest person. I'd be willing to meet you somewhere up in the middle. What do you say we make it 1100 and I'll cover electricity for the first two months?,
11013,C_17458bff694d4e23b830246b3315ac31,0,"Can you do $975? I really want this studio, and that's about as much as I can afford.",
11014,C_17458bff694d4e23b830246b3315ac31,1,I'll do 975 and cover electricity for 1 month at that price.,
11015,C_17458bff694d4e23b830246b3315ac31,0,That sounds perfect. I will send you an official offer of $975.,
11016,C_17458bff694d4e23b830246b3315ac31,1,Awesome. Enjoy!,
11136,C_9841d57b7e8043d9a934e3328a5b297e,0,Hey there.  I'm very interested in your car.,
11137,C_9841d57b7e8043d9a934e3328a5b297e,1,"Hello. Yes, it's still available.",
11138,C_9841d57b7e8043d9a934e3328a5b297e,0,Excellent.  I love Mustangs.  Why are you getting rid of it?,
11139,C_9841d57b7e8043d9a934e3328a5b297e,1,I have a new one and have not had a chance to take this one out in a while. It's just sitting in the garage.,
11140,C_9841d57b7e8043d9a934e3328a5b297e,0,How long has it been sitting in a garage?,
11141,C_9841d57b7e8043d9a934e3328a5b297e,1,Just for a month or so. It's been maintained and started regularly. It's very clean and runs great.,
11142,C_9841d57b7e8043d9a934e3328a5b297e,0,That sounds great.  It looks like it's in great shape.  What kind of mileage does it have on it?,
11143,C_9841d57b7e8043d9a934e3328a5b297e,1,"Only 15,000 miles.",
11144,C_9841d57b7e8043d9a934e3328a5b297e,0,"Wow, that's incredible.  Would you take $20000 for it, and I can pay in cash today?",
11145,C_9841d57b7e8043d9a934e3328a5b297e,1,"I was looking to stay close to $28,500. The car is pretty much new. Has very low mileage. it's well maintained.",
11146,C_9841d57b7e8043d9a934e3328a5b297e,0,"I really want this car, but that's a little too rich for my blood.  How about 23000, because blue is my favorite color.",
11147,C_9841d57b7e8043d9a934e3328a5b297e,1,"The lowest I can go is $26,000",
11148,C_9841d57b7e8043d9a934e3328a5b297e,0,"How about $25,500, and I'll name it after you?",
11149,C_9841d57b7e8043d9a934e3328a5b297e,1,"I can do $25,900. No lower than that.",
11150,C_9841d57b7e8043d9a934e3328a5b297e,0,Deal.,
11210,C_47c2fabc2c2f46b8ad35fea1a28e0eba,0,Hello. How is the couch in great condition?,
11211,C_47c2fabc2c2f46b8ad35fea1a28e0eba,1,"Well even though we have had it for about five years, we have always kept it as clean as possible.",
11212,C_47c2fabc2c2f46b8ad35fea1a28e0eba,0,Thanks! Is it comfortable?,
11213,C_47c2fabc2c2f46b8ad35fea1a28e0eba,1,"Yes, it is extremely comfortable, and it almost has a perfect rating.",
11214,C_47c2fabc2c2f46b8ad35fea1a28e0eba,0,Sounds good. Would you accept $1345?,
11215,C_47c2fabc2c2f46b8ad35fea1a28e0eba,1,"That seems a little low, could you go a bit higher?",
11216,C_47c2fabc2c2f46b8ad35fea1a28e0eba,0,Would you accept $1375?,
11217,C_47c2fabc2c2f46b8ad35fea1a28e0eba,1,Could you do $1395?,
11218,C_47c2fabc2c2f46b8ad35fea1a28e0eba,0,That works!,
11219,C_47c2fabc2c2f46b8ad35fea1a28e0eba,1,Thanks,
11241,C_d2ff25ca3e3f442aade45f5ca2b749ac,1,Hello,
11242,C_d2ff25ca3e3f442aade45f5ca2b749ac,0,howdy. so moving eh?,
11243,C_d2ff25ca3e3f442aade45f5ca2b749ac,1,Yes. I'm selling my bed for $200.,
11244,C_d2ff25ca3e3f442aade45f5ca2b749ac,0,"200 is a bit out my price range. tell you what, i'll give you 100 for it and i'll come and pick it up",
11245,C_d2ff25ca3e3f442aade45f5ca2b749ac,1,"Sorry, I want at least $150 for it.",
11246,C_d2ff25ca3e3f442aade45f5ca2b749ac,0,i see. 150... well does it have bed frame?,
11247,C_d2ff25ca3e3f442aade45f5ca2b749ac,1,"Yes, it comes with a bed frame and a mattress.",
11248,C_d2ff25ca3e3f442aade45f5ca2b749ac,0,"ok, then tell you what. if you deliver it for me for 150, we have a deal",
11249,C_d2ff25ca3e3f442aade45f5ca2b749ac,1,$150 and you can pick it up. $160 for shipping.,
11250,C_d2ff25ca3e3f442aade45f5ca2b749ac,0,"now if I have to come and pick it up, let's do 140 for the whole thing",
11251,C_d2ff25ca3e3f442aade45f5ca2b749ac,1,Fine.,
11319,C_19080ee75f6d4997bc5e07c77ea9c44c,1,Thanks for viewing the listing.,
11320,C_19080ee75f6d4997bc5e07c77ea9c44c,0,good can you tell me the color and if it is the full size with three seatings or more,
11321,C_19080ee75f6d4997bc5e07c77ea9c44c,1,The color is very light grey and it is full size with three seats.,
11322,C_19080ee75f6d4997bc5e07c77ea9c44c,0,wonderful about the height of the feet from floor to head rest theres no picture but i do know the brand is nice but i need to know how nice i will offer 207 in cash and you deliver,
11323,C_19080ee75f6d4997bc5e07c77ea9c44c,1,"From floor to headrest is roughly 4.5 feet. I apologize, but I can't go that low. Can you do $390?",
11324,C_19080ee75f6d4997bc5e07c77ea9c44c,0,thats steep with no picture how about 250 are there any  pillows or throws chairs,
11325,C_19080ee75f6d4997bc5e07c77ea9c44c,1,"There are throws and chairs, but sold separately. I'll throw them in too $300.",
11326,C_19080ee75f6d4997bc5e07c77ea9c44c,0,everything for 300 wow,
11327,C_19080ee75f6d4997bc5e07c77ea9c44c,1,"Great deal, right?",
11328,C_19080ee75f6d4997bc5e07c77ea9c44c,0,yes,
11367,C_79eebd02c22048c19beb051dbf0276ac,0,Hello,
11368,C_79eebd02c22048c19beb051dbf0276ac,1,"Hi, how are you doing today?",
11369,C_79eebd02c22048c19beb051dbf0276ac,0,Good thanks. I was looking at your listing for the Mustang... is that the original paint ?,
11370,C_79eebd02c22048c19beb051dbf0276ac,1,No thats a special paintjob.       Its an upgraded metallic paint.    Paint job alone cost me $600  bucks,
11371,C_79eebd02c22048c19beb051dbf0276ac,0,Great. How many miles does it have on it?,
11372,C_79eebd02c22048c19beb051dbf0276ac,1,For being a nearly 8 year vehicle the Roush Mustang only has 15K miles on it,
11373,C_79eebd02c22048c19beb051dbf0276ac,0,Great. What kind of mileage is it though? What kind of driving have you done with it?,
11374,C_79eebd02c22048c19beb051dbf0276ac,1,"Vehicle has had only 1 owner (myself)   purchased Mustang with only 12 miles on it.    I have only done local driving with the car,  averaging just under 2k Miles a year with it.   This is not my primary transportation.  I have kept up on the oil changes and just did a full tune up on the car 8 months ago. . .. . . purring like a kitten",
11375,C_79eebd02c22048c19beb051dbf0276ac,0,"Alright, I would like to come check it out and get a test drive. If I am able to pay cash would you consider $25000?",
11376,C_79eebd02c22048c19beb051dbf0276ac,1,"Best I will accept (cash offer)   would be an even $27,000  because a non mod  clean ass Roush Mustang is a rare find today and mine is in amazing condition and has been WELL up-kept and maintained",
11377,C_79eebd02c22048c19beb051dbf0276ac,0,Do you have a cover for it?,
11378,C_79eebd02c22048c19beb051dbf0276ac,1,"Yes I can include the ""like new""  cover for the Mustang and throw in some Armorall for the Wheels and the Interior, and the matching Seat Covers and Wheel cover  for and even  $27,100?    :)",
11379,C_79eebd02c22048c19beb051dbf0276ac,0,That sounds fair.,
