,Index,User,Text,Face acts
9255,C_b84d489c3dd04c20a5262a85752e6245,1,"Okay, it's a deal.",
9256,C_174d9d4786aa492c817496adfec806de,1,Hello,
9257,C_174d9d4786aa492c817496adfec806de,0,Hi There!,
9258,C_174d9d4786aa492c817496adfec806de,1,Do you fancy this item I am parting with?,
9259,C_174d9d4786aa492c817496adfec806de,0,Yes.. Does it work for any type of Iphone?,
9260,C_174d9d4786aa492c817496adfec806de,1,"Yes, it works with iPhone and iPod and iPad.",
9261,C_174d9d4786aa492c817496adfec806de,0,How is the audio?,
9262,C_174d9d4786aa492c817496adfec806de,1,It's excellent. It is like new. You are getting a great item here.,
9263,C_174d9d4786aa492c817496adfec806de,0,Oh great! Will you accept $28?,
9264,C_174d9d4786aa492c817496adfec806de,1,I'd like 35. Is that okay with you?,
9265,C_174d9d4786aa492c817496adfec806de,0,How about $30 and I can pick it up. So you don't need to ship it,
9266,C_174d9d4786aa492c817496adfec806de,1,That works for me. 30 it will be.,
9267,C_174d9d4786aa492c817496adfec806de,0,Thanks,
9302,C_6b53f57720064092b11753a9f8525508,0,Hi is this still available?,
9303,C_6b53f57720064092b11753a9f8525508,1,This is! Would you like it?,
9304,C_6b53f57720064092b11753a9f8525508,0,"How is the condtition, any issues?",
9305,C_6b53f57720064092b11753a9f8525508,1,Nope. It is in excellent condition and works like its new!,
9306,C_6b53f57720064092b11753a9f8525508,0,"I am on a budget though, can you negotiate on the price",
9307,C_6b53f57720064092b11753a9f8525508,1,I am willing to do that. Is there  a price you are looking to pay?,
9308,C_6b53f57720064092b11753a9f8525508,0,$20 is ideal for my budget,
9309,C_6b53f57720064092b11753a9f8525508,1,How about $25?,
9310,C_6b53f57720064092b11753a9f8525508,0,For $25 can you deliver it please?,
9311,C_6b53f57720064092b11753a9f8525508,1,Yes I can,
9312,C_6b53f57720064092b11753a9f8525508,0,"great, Deal!",
9333,C_27146aa5f768469f831aae5e53cde22d,1,"Hi, are you interested in this apartment?",
9334,C_27146aa5f768469f831aae5e53cde22d,0,Yes I am,
9335,C_27146aa5f768469f831aae5e53cde22d,1,It's a great apartment in a wonderful community. What are you willing to offer?,
9336,C_27146aa5f768469f831aae5e53cde22d,0,I'm willing to offer 1520,
9337,C_27146aa5f768469f831aae5e53cde22d,1,"How about 1900? It's a  quiet community, and there's a pool in the development!",
9338,C_27146aa5f768469f831aae5e53cde22d,0,"I absolutely love the description, however, I have received much lower prices for the same amenities",
9339,C_27146aa5f768469f831aae5e53cde22d,1,The lowest I can go is $1800. Any less than that and I'll be losing money. Would that work for you?,
9340,C_27146aa5f768469f831aae5e53cde22d,0,"Let's meet in the middle, 1700",
9341,C_27146aa5f768469f831aae5e53cde22d,1,1750?,
9342,C_27146aa5f768469f831aae5e53cde22d,0,1725,
9343,C_27146aa5f768469f831aae5e53cde22d,1,"Okay, deal",
9358,C_ffd3fff2e59f4120904bd2c6e33671a1,0,"Hey, I'm interested in your Honda CRV. What condition is it in?",
9359,C_ffd3fff2e59f4120904bd2c6e33671a1,1,"Hey there, it's like new and gets 27 MPG.",
9360,C_ffd3fff2e59f4120904bd2c6e33671a1,0,How many miles does it have on the engine?,
9361,C_ffd3fff2e59f4120904bd2c6e33671a1,1,"I don't have that information with me right now, but the mileage should be minimal.",
9362,C_ffd3fff2e59f4120904bd2c6e33671a1,0,What options does it have on it?,
9363,C_ffd3fff2e59f4120904bd2c6e33671a1,1,"We have front wheel drive, power steering, aluminum wheels, All-Season tires, rear defrost, privacy glass, intermittent wipers, power locks, automatic headlights, fog lamps, and stereo/CD/Mp3 player.",
9364,C_ffd3fff2e59f4120904bd2c6e33671a1,0,Nice. You don't have a listing price on the vehicle. What are you asking and how flexible are you?,
9365,C_ffd3fff2e59f4120904bd2c6e33671a1,1,"My listing price is 22,000, give or take.",
9366,C_ffd3fff2e59f4120904bd2c6e33671a1,0,"Ooo. 22,000 is a little too high for me. Would you entertain 16000?",
9367,C_ffd3fff2e59f4120904bd2c6e33671a1,1,"The lowest I can go for this car is 19,000. Would that be reasonable?",
9368,C_ffd3fff2e59f4120904bd2c6e33671a1,0,It's still too much of a reach for me at that pricce point. I have to walk away from that. Thanks anyway!,
9369,C_a7bea19c528a46ee85ef9b9dab00259f,0,Hello there.,
9370,C_a7bea19c528a46ee85ef9b9dab00259f,1,"Hello, I have my trusted Jaguar that is for sale at the low price of $3500. It is a steal of a deal because it is in immaculate condition.",
9371,C_a7bea19c528a46ee85ef9b9dab00259f,0,According to your description it's in good condition and is reliable.,
9372,C_a7bea19c528a46ee85ef9b9dab00259f,1,Yes it certainly is you cannot go wrong with this vehicle,
9373,C_a7bea19c528a46ee85ef9b9dab00259f,0,It's also 15 years old. What is the absolute lowest price you'll take for it.,
9374,C_a7bea19c528a46ee85ef9b9dab00259f,1,Give me $3000 and she's yours.,
9375,C_a7bea19c528a46ee85ef9b9dab00259f,0,I still think that's a bit too high. How close are you willing to come to $2200?,
9376,C_a7bea19c528a46ee85ef9b9dab00259f,1,"Even though she is old she has modern updates. I put a lot in this car, not forgetting that she is a Jaguar. $2900 and you have a deal",
9377,C_a7bea19c528a46ee85ef9b9dab00259f,0,How about $2500? I don't know if these aftermarket parts or authentic Jaguar parts..,
9378,C_a7bea19c528a46ee85ef9b9dab00259f,1,I don't use anything that is not in keeping with the Jaguar name. $2850 final offer.,
9379,C_2ffdf756a2954b77b900ba4cf532292b,1,Are you in the market for a race bike? Because this one of the top race bikes in the world,
9380,C_2ffdf756a2954b77b900ba4cf532292b,0,"I might be interested, but the price seems too high.",
9381,C_2ffdf756a2954b77b900ba4cf532292b,1,How much are you looking to spend?,
9382,C_2ffdf756a2954b77b900ba4cf532292b,0,Only about $350 or so,
9383,C_2ffdf756a2954b77b900ba4cf532292b,1,"Ouch...this bike has been well maintained by a pro mechanic for years, it still runs like it's new. This isn't a $350 bike",
9384,C_2ffdf756a2954b77b900ba4cf532292b,0,Sorry I don't mean to insult you. It does look like a nice bike. What's the lowest that you are willing to go on it?,
9385,C_2ffdf756a2954b77b900ba4cf532292b,1,$600 and I'll deliver it to the location of your choice,
9386,C_2ffdf756a2954b77b900ba4cf532292b,0,I wish I could say yes but I just can't. It's still a little too high for me. Could you meet me in the middle at $475?,
9387,C_2ffdf756a2954b77b900ba4cf532292b,1,$550 and you've got a deal,
9388,C_2ffdf756a2954b77b900ba4cf532292b,0,I can't do that. I'm going to have to modify it for it to be able to work for me.,
9389,C_2ffdf756a2954b77b900ba4cf532292b,1,"Why's that? And $500, final offer",
9390,C_2ffdf756a2954b77b900ba4cf532292b,0,I can do $500.,
9434,C_5731b8e18a7c406199aa55697a667986,0,Hi so I'm very interested in the place but I have some questions.,
9435,C_5731b8e18a7c406199aa55697a667986,1,Sure! Fire away!,
9436,C_5731b8e18a7c406199aa55697a667986,0,Ok is the apartment complex in a gated community? My car had broken into at my last apartment so I'm looking to keep my car safe.,
9437,C_5731b8e18a7c406199aa55697a667986,1,Hello! Are you interested in the property?,
9438,C_5731b8e18a7c406199aa55697a667986,0,Yes I am. Can you tell me a little bit about the place? It looks great.,
9439,C_5731b8e18a7c406199aa55697a667986,1,"It is a great place! Beautiful lanscaped, pool, golf, balcony, etc.",
9440,C_5731b8e18a7c406199aa55697a667986,0,Ok great. Are the apartments gated?,
9441,C_5731b8e18a7c406199aa55697a667986,1,They are! Very private.,
9442,C_5731b8e18a7c406199aa55697a667986,0,"How many bedrooms are in the apartment? I'm really looking for 2 bedroom, 1 bath.",
9443,C_5731b8e18a7c406199aa55697a667986,1,It is just that!,
9444,C_5731b8e18a7c406199aa55697a667986,0,I can give you $1450 cash if I can move in tomorrow morning.,
9445,C_5731b8e18a7c406199aa55697a667986,1,"How about 1,600?",
9446,C_5731b8e18a7c406199aa55697a667986,0,Can we meet half way at $1550,
9447,C_5731b8e18a7c406199aa55697a667986,1,Sure! We have a deal!,
9471,C_7befa4e399d8438f9bfb55e8452b2311,1,"So, are you interested in this bike?",
9472,C_7befa4e399d8438f9bfb55e8452b2311,0,"Yes, Are the tires in good shape?",
9473,C_7befa4e399d8438f9bfb55e8452b2311,1,They are in great shape.  Tread is barely worn.  I use it for both riding in town and for trail riding.,
9474,C_7befa4e399d8438f9bfb55e8452b2311,0,Ok it says the pedals are  not included. Would you take 1400?,
9475,C_7befa4e399d8438f9bfb55e8452b2311,1,"I'll take a little less, but I can't go $1400.  The pedals are only worth about $100.  I'd be willing to take $1525 if you want it now.",
9476,C_7befa4e399d8438f9bfb55e8452b2311,0,What if I bought just the frame? I would pay 1485,
9477,C_7befa4e399d8438f9bfb55e8452b2311,1,I can do $1500 and I'll bring it to you.,
9478,C_7befa4e399d8438f9bfb55e8452b2311,0,Sounds like a good deal to me!,
9479,C_7befa4e399d8438f9bfb55e8452b2311,1,Thanks.  I'm sure you'll love the bike.,
9480,C_7befa4e399d8438f9bfb55e8452b2311,0,thank you!,
9533,C_7b8d99e0c3d7423f9c8700eccc417866,0,How much wear does your TV have?,
9534,C_7b8d99e0c3d7423f9c8700eccc417866,1,It has not been used and is in flawless condition,
9535,C_7b8d99e0c3d7423f9c8700eccc417866,0,"I see, does it also come with the manual and all wires?",
9536,C_7b8d99e0c3d7423f9c8700eccc417866,1,Yes and it is still under warranty. I would like to get 1400 cash for it but I am willing to go a little lower.,
9537,C_7b8d99e0c3d7423f9c8700eccc417866,0,I can give you $1150 and pick it up myself if I am able to test it first.,
9538,C_7b8d99e0c3d7423f9c8700eccc417866,1,"That's a little too low, I would be willing to go 1300 cash",
9539,C_7b8d99e0c3d7423f9c8700eccc417866,0,1250?,
9540,C_7b8d99e0c3d7423f9c8700eccc417866,1,1275 and you have a deal.,
9541,C_7b8d99e0c3d7423f9c8700eccc417866,0,I can't withdraw more than $1000 in cash from my bank at one time and I only have $50 on me right now. Are you sure that $25 is that important?,
9542,C_7b8d99e0c3d7423f9c8700eccc417866,1,"Ok, you pick up and load it for 1250",
9543,C_7b8d99e0c3d7423f9c8700eccc417866,0,You got it!,
9632,C_d9dd5ea5bb1e4fd7a7100c51476a97e1,1,Hello,
9633,C_d9dd5ea5bb1e4fd7a7100c51476a97e1,0,"HI, how tall is this unit?",
9634,C_d9dd5ea5bb1e4fd7a7100c51476a97e1,1,It's about 30 inches tall,
9635,C_d9dd5ea5bb1e4fd7a7100c51476a97e1,0,I assume it's 30 square then?,
9636,C_d9dd5ea5bb1e4fd7a7100c51476a97e1,1,"Yes, it seems small but really holds a lot",
9637,C_d9dd5ea5bb1e4fd7a7100c51476a97e1,0,Sure. Any scratches of scuffs?,
9638,C_d9dd5ea5bb1e4fd7a7100c51476a97e1,1,"The top surface is a bit dinged up and there is a small puncture, other than that it's great!",
9639,C_d9dd5ea5bb1e4fd7a7100c51476a97e1,0,"Are you taking it apart for sale, or am I picking it up as is?",
9640,C_d9dd5ea5bb1e4fd7a7100c51476a97e1,1,It would be as is,
9641,C_d9dd5ea5bb1e4fd7a7100c51476a97e1,0,"Ok, could you let it go for $35?",
9642,C_d9dd5ea5bb1e4fd7a7100c51476a97e1,1,"35 is a bit low, but since it does have the dings in it, I would take 40.",
9643,C_d9dd5ea5bb1e4fd7a7100c51476a97e1,0,$40 would work,
9644,C_d9dd5ea5bb1e4fd7a7100c51476a97e1,1,great!,
9770,C_907685193c7548d1b96038f4a2d8ae33,0,hello,
9771,C_907685193c7548d1b96038f4a2d8ae33,1,Hi there. Do you have any questions?,
9772,C_907685193c7548d1b96038f4a2d8ae33,0,"Yes, can I stop by and have a look at the place?",
9773,C_907685193c7548d1b96038f4a2d8ae33,1,"Sure thing. It a great place. Close to the TAFB, 3 bedrooms, and everything has been replaced, new cabinets, new appliances, and everything is included.",
9774,C_907685193c7548d1b96038f4a2d8ae33,0,Is it in a nice area?,
9775,C_907685193c7548d1b96038f4a2d8ae33,1,"Yes, it is a great neighborhood. Good for children;",
9776,C_907685193c7548d1b96038f4a2d8ae33,0,I am looking to save a little bit of money here. Would 950 be okay?,
9777,C_907685193c7548d1b96038f4a2d8ae33,1,"$950 is way too low, I need a serious offer. I can drop the price down to 1895 for you though",
9778,C_907685193c7548d1b96038f4a2d8ae33,0,How about 1700? That would be a bit better.,
9779,C_907685193c7548d1b96038f4a2d8ae33,1,$1800?,
9780,C_907685193c7548d1b96038f4a2d8ae33,0,Sounds good. Deal,
9804,C_3f59f1f48f394ea095b94ef008461d62,1,Good Afternoon,
9805,C_3f59f1f48f394ea095b94ef008461d62,0,Hello how are you? Is there any chance you'd be willing to lower the pay possibly?,
9806,C_3f59f1f48f394ea095b94ef008461d62,1,I have a little room for negotiation. Keep in mind that this unit has a lot of amenities.,
9807,C_3f59f1f48f394ea095b94ef008461d62,0,That's quite understandable.,
9808,C_3f59f1f48f394ea095b94ef008461d62,1,What price did you have in mind?,
9809,C_3f59f1f48f394ea095b94ef008461d62,0,$2400?,
9810,C_3f59f1f48f394ea095b94ef008461d62,1,"We were looking to get $2471 because of the clubhouse, fitness center, pool and view. Can you go a little higher?",
9811,C_3f59f1f48f394ea095b94ef008461d62,0,$2450?,
9812,C_3f59f1f48f394ea095b94ef008461d62,1,That'll work. $2450 it is. Pleasure working with you.,
9813,C_3f59f1f48f394ea095b94ef008461d62,0,Thanks!,
9814,C_6cdb1d5557344e78b9ad54e757520ef8,0,What size is this bike?,
9815,C_6cdb1d5557344e78b9ad54e757520ef8,1,"hi, it's 18 inch.",
9816,C_6cdb1d5557344e78b9ad54e757520ef8,0,Ok. I'm looking for an affordable BMX as a gift for my nephew. Any issues I should know of?,
9817,C_6cdb1d5557344e78b9ad54e757520ef8,1,"nope... it's in a very good shape, little bit of touch up and it's good to gift! and i think at $10 it's a steal..",
9818,C_6cdb1d5557344e78b9ad54e757520ef8,0,How long have you had it?,
9819,C_6cdb1d5557344e78b9ad54e757520ef8,1,just 2 years.. not used much,
9820,C_6cdb1d5557344e78b9ad54e757520ef8,0,"I'm taking a risk here since I don't know for sure if it has issues or not, so I'll give you 8$ for it.",
9821,C_6cdb1d5557344e78b9ad54e757520ef8,1,"i can trade it for old coins too if you collect them... if not i can do 8, but you will have to pick it up",
9822,C_6cdb1d5557344e78b9ad54e757520ef8,0,OK sounds like a deal,
9823,C_6cdb1d5557344e78b9ad54e757520ef8,1,nice!,
9834,C_bb257843a96f4bef8529cac5d92dd3eb,1,Hello,
9835,C_bb257843a96f4bef8529cac5d92dd3eb,0,hello,
9836,C_bb257843a96f4bef8529cac5d92dd3eb,1,Are you interested in my Iphone 6s?,
9837,C_bb257843a96f4bef8529cac5d92dd3eb,0,"Yes, I do",
9838,C_bb257843a96f4bef8529cac5d92dd3eb,1,I am asking 600 dollars for it.,
9839,C_bb257843a96f4bef8529cac5d92dd3eb,0,Any issues with the phone?,
9840,C_bb257843a96f4bef8529cac5d92dd3eb,1,"no, it works great! You can use it on any network and has a big screen",
9841,C_bb257843a96f4bef8529cac5d92dd3eb,0,Is delivery cost included in the price?,
9842,C_bb257843a96f4bef8529cac5d92dd3eb,1,"Yes, AND i WILL EVEN THROW IN SOME SCREEN PROTECTORS!",
9843,C_bb257843a96f4bef8529cac5d92dd3eb,0,How about the battery life?,
9844,C_bb257843a96f4bef8529cac5d92dd3eb,1,"Battery life is good, unless you take a lot of videos, usually lasts me all day.",
9913,C_9134ed61e8784d3ea602fda079474b12,1,Looks like you're in the market for a beauty of a car today!  Nissan is a great car.  Very reliable.,
9914,C_9134ed61e8784d3ea602fda079474b12,0,yeah it looks nice can you tell me something about it?,
9915,C_9134ed61e8784d3ea602fda079474b12,1,"It's bright red and sporty!  No accidents.  All the paperwork will be completed for you so less hassle with the DMV -- which is worth the price alone!  I'm asking $8,500.  How's that sound?",
9916,C_9134ed61e8784d3ea602fda079474b12,0,will you take $4500 if I do the paperworks?,
9917,C_9134ed61e8784d3ea602fda079474b12,1,"Ooo... I can't go that low.  Gotta be fair to my other customers, ya know.  I can do $8,000 and we'll deliver it to your door.",
9918,C_9134ed61e8784d3ea602fda079474b12,0,you will deliver the car with the paperworks?,
9919,C_9134ed61e8784d3ea602fda079474b12,1,"You bet!  We good at $8,000?  You won't be disappointed!",
9920,C_9134ed61e8784d3ea602fda079474b12,0,How about of full tank of gas?,
9921,C_9134ed61e8784d3ea602fda079474b12,1,"I can certainly do that.  AND, I'll even put a Elvis Presley CD in the CD player for you.",
9922,C_9134ed61e8784d3ea602fda079474b12,0,Sounds like a good deal to me . Lets do it.,
9923,C_9134ed61e8784d3ea602fda079474b12,1,You got it! Enjoy!,
9962,C_b652412b340648028a512b6e74cab04a,0,Hello,
9963,C_b652412b340648028a512b6e74cab04a,1,Hi! Interested in the Helix?,
9964,C_b652412b340648028a512b6e74cab04a,0,I am. Is it in good condition? I have been looking for a quality one for some time now.,
9965,C_b652412b340648028a512b6e74cab04a,1,"It's brand-new, in the box, still sealed. As good a condition as you can get!",
9966,C_b652412b340648028a512b6e74cab04a,0,Great news. How much would you like for it?,
9967,C_b652412b340648028a512b6e74cab04a,1,"It's listed on Amazon at $839, but I'm willing to let it go for less, obviously.",
9968,C_b652412b340648028a512b6e74cab04a,0,I was hoping to pay around 400 dollars.,
9969,C_b652412b340648028a512b6e74cab04a,1,"That's a little low, less than half what you'd get it for in store. Can we bring that up some? Maybe $550?",
9970,C_b652412b340648028a512b6e74cab04a,0,550 sounds good. Can I pick it up today?,
9971,C_b652412b340648028a512b6e74cab04a,1,Sure! Works for me! Thanks.,
9972,C_58c295d9f05b4eed852a9d0496897177,1,Hello,
9973,C_58c295d9f05b4eed852a9d0496897177,0,Hi how many miles does the truck have,
9974,C_58c295d9f05b4eed852a9d0496897177,1,"About 150,000",
9975,C_58c295d9f05b4eed852a9d0496897177,0,does it have air conditioning?,
9976,C_58c295d9f05b4eed852a9d0496897177,1,"Yes, works great",
9977,C_58c295d9f05b4eed852a9d0496897177,0,would you accept 3500 cash for it?,
9978,C_58c295d9f05b4eed852a9d0496897177,1,"I can't accept that, it's lower than I was going for",
9979,C_58c295d9f05b4eed852a9d0496897177,0,how low can you go on this?,
9980,C_58c295d9f05b4eed852a9d0496897177,1,"I could do $4,300. How's that?",
9981,C_58c295d9f05b4eed852a9d0496897177,0,that's the list price you have it advertised at.  Since it is a short bed and not a long bed I'm willing to pay $3800,
9982,C_58c295d9f05b4eed852a9d0496897177,1,I'll take it.,
10044,C_70eb9727990841d2bf293610b4b50b4f,0,Hello I'm interested in the town home you have listed,
10045,C_70eb9727990841d2bf293610b4b50b4f,1,"yeah, it's in a nice area, recently rennovated. gorgeous inside",
10046,C_70eb9727990841d2bf293610b4b50b4f,0,I can pay about 1250.,
10047,C_70eb9727990841d2bf293610b4b50b4f,1,ouch. that's very low for home this size and given all the amenities.,
10048,C_70eb9727990841d2bf293610b4b50b4f,0,can you negotiate a lower price?,
10049,C_70eb9727990841d2bf293610b4b50b4f,1,i guess i can give it to you for 2100 if you sign a 1 year lease,
10050,C_70eb9727990841d2bf293610b4b50b4f,0,That's kind of out of my affordable range. The most I could do is probably 1650,
10051,C_70eb9727990841d2bf293610b4b50b4f,1,"Yeah that's not going to work. Tell you what, if you do 3 year lease, i can do 1900 a month",
10052,C_70eb9727990841d2bf293610b4b50b4f,0,I'll sign the lease today if you can do 1800,
10053,C_70eb9727990841d2bf293610b4b50b4f,1,1800... that will require a 4 year lease. and every year the home will have to be inspected and you will have to pay for any repairs or cleaning that's needed.,
10054,C_70eb9727990841d2bf293610b4b50b4f,0,I accept.,
10055,C_70eb9727990841d2bf293610b4b50b4f,1,ok that's a deal,
10104,C_f8bab2dcb0d14f76a73bc20a39d5229f,1,hello,
10105,C_f8bab2dcb0d14f76a73bc20a39d5229f,0,"Hi, I am interested in the phone.",
10106,C_f8bab2dcb0d14f76a73bc20a39d5229f,1,what is your offer,
10107,C_f8bab2dcb0d14f76a73bc20a39d5229f,0,Has this phone ever been used? Any damage or scratches?,
10108,C_f8bab2dcb0d14f76a73bc20a39d5229f,1,nope brand new,
10109,C_f8bab2dcb0d14f76a73bc20a39d5229f,0,So it is still in the box? All paperwork for it still available? Is it unlocked?,
10110,C_f8bab2dcb0d14f76a73bc20a39d5229f,1,yes  stiill in box,
10111,C_f8bab2dcb0d14f76a73bc20a39d5229f,0,You didn't answer the question about the Paperwork?,
10112,C_f8bab2dcb0d14f76a73bc20a39d5229f,1,all the paper work is in the box and it unlocked,
10113,C_f8bab2dcb0d14f76a73bc20a39d5229f,0,"I am interested in the phone, however, I think the asking price is a little high. Would you be willing to accept $450?",
10114,C_f8bab2dcb0d14f76a73bc20a39d5229f,1,i take 500,
10115,C_f8bab2dcb0d14f76a73bc20a39d5229f,0,$475 is the highest I can go for this phone. Cash in hand today!,
10116,C_f8bab2dcb0d14f76a73bc20a39d5229f,1,475,
10117,C_f8bab2dcb0d14f76a73bc20a39d5229f,0,You got a deal then.,
10118,C_f8bab2dcb0d14f76a73bc20a39d5229f,1,ok,
10119,C_ba0504e9987b494e83818f49f56f9341,0,This is beautiful. How long have you had it?,
10120,C_ba0504e9987b494e83818f49f56f9341,1,"I had it for about 1 year, but it doesn't fit my decor now that I'm redecorating.",
10121,C_ba0504e9987b494e83818f49f56f9341,0,Any chips in the base?,
10122,C_ba0504e9987b494e83818f49f56f9341,1,No. It's in great condition.,
10123,C_ba0504e9987b494e83818f49f56f9341,0,And it comes with a white lampshade?,
10124,C_ba0504e9987b494e83818f49f56f9341,1,Yes. All the parts are there,
10125,C_ba0504e9987b494e83818f49f56f9341,0,"Is it heavy, do you know how much it weighs?",
10126,C_ba0504e9987b494e83818f49f56f9341,1,"No. I don't know exactly how much it weighs but It's pretty light weight. The base measures 8.5 diameter and is 3"" thick",
10127,C_ba0504e9987b494e83818f49f56f9341,0,I only ask because I was wondering if you ship it or is it only for pickup?,
10128,C_ba0504e9987b494e83818f49f56f9341,1,It can be shipped or picked up.,
10129,C_ba0504e9987b494e83818f49f56f9341,0,Could you let it go for $135?,
10130,C_ba0504e9987b494e83818f49f56f9341,1,Deal,
10131,C_ba0504e9987b494e83818f49f56f9341,0,Great. I'm really happy we could come to a deal. I think I will be able ot pick it up anyway. Would tomorrow do?,
10132,C_ba0504e9987b494e83818f49f56f9341,1,Yes. Tommorow would be great.,
10133,C_ba0504e9987b494e83818f49f56f9341,0,Great. I'll see you then.,
10181,C_a1fd34901f38444d9078d87cd63e7127,0,"Hi, I'm interested in buying the matte black iPhone 6 but I have some questions.",
10182,C_a1fd34901f38444d9078d87cd63e7127,1,Excellent.  Go ahead.,
10183,C_a1fd34901f38444d9078d87cd63e7127,0,"First, are there any scratches, dings, or other imperfections?",
10184,C_a1fd34901f38444d9078d87cd63e7127,1,"The phone is practically like new.  No scratches or dings, etc.",
10185,C_a1fd34901f38444d9078d87cd63e7127,0,"Great. Do you know the retail price by chance? How long have you had it? What makes it ""custom?""",
10186,C_a1fd34901f38444d9078d87cd63e7127,1,I do not know the retail price offhand.,
10187,C_a1fd34901f38444d9078d87cd63e7127,0,That's okay. I can look it up.,
10188,C_a1fd34901f38444d9078d87cd63e7127,1,I think I have had it like six months maybe.,
10189,C_a1fd34901f38444d9078d87cd63e7127,0,"Ah, not long. Why are you getting rid of it?",
10190,C_a1fd34901f38444d9078d87cd63e7127,1,IPhone 7 is out.  I want that one before the new one comes out!,
10191,C_a1fd34901f38444d9078d87cd63e7127,0,Haha I understand! It's for my husband. He broke his phone and doesn't want to spend a ton on a new one. Would you accept $125? I found a gold one for $120 earlier but it was too far.,
10192,C_a1fd34901f38444d9078d87cd63e7127,1,Ouch!  No.  I'm sorry.  I can only go as low as $300.00.  It has 64 Gigabytes!,
10193,C_a1fd34901f38444d9078d87cd63e7127,0,That might be a bit out of our price range. Does it come with a charger?,
10194,C_a1fd34901f38444d9078d87cd63e7127,1,"Yes, it comes with a charger, and as indicated, it has a custom paint job!  It is totally worth it.",
10235,C_b8f2c9ab52cb41a9a919f4472a068e1a,0,hello how are you,
10236,C_b8f2c9ab52cb41a9a919f4472a068e1a,1,good how are you?,
10237,C_b8f2c9ab52cb41a9a919f4472a068e1a,0,good thanks do you still have the sofa for sale?,
10238,C_b8f2c9ab52cb41a9a919f4472a068e1a,1,I do are you interested?,
10239,C_b8f2c9ab52cb41a9a919f4472a068e1a,0,yes please are you willing to budge on the price any???,
10240,C_b8f2c9ab52cb41a9a919f4472a068e1a,1,there is some room to wiggle,
10241,C_b8f2c9ab52cb41a9a919f4472a068e1a,0,Would you take 340?,
10242,C_b8f2c9ab52cb41a9a919f4472a068e1a,1,I can go down to 400,
10243,C_b8f2c9ab52cb41a9a919f4472a068e1a,0,Slightly out of my budget can we meet at  360?,
10244,C_b8f2c9ab52cb41a9a919f4472a068e1a,1,can you pick it up? If so I can do 375,
10245,C_b8f2c9ab52cb41a9a919f4472a068e1a,0,Done,
10246,C_b8f2c9ab52cb41a9a919f4472a068e1a,1,so 375 then,
10398,C_08c24252a78d48cd9a4cd400385df1d3,1,Hello!,
10399,C_08c24252a78d48cd9a4cd400385df1d3,0,Hi. I'm interesting in buying your car. However I have a few questions.,
10400,C_08c24252a78d48cd9a4cd400385df1d3,1,"Sure go ahead, my asking price is $9200.",
10401,C_08c24252a78d48cd9a4cd400385df1d3,0,Does it need any repairs?,
10402,C_08c24252a78d48cd9a4cd400385df1d3,1,"No, my car is fairly new. I bought it new in 2015 and have had no problems since, but I can take it to a mechanic to confirm and send you the details after if you agree to purchase the car.",
10403,C_08c24252a78d48cd9a4cd400385df1d3,0,Okay. Great. Are you a smoker?,
10404,C_08c24252a78d48cd9a4cd400385df1d3,1,Nope!,
10405,C_08c24252a78d48cd9a4cd400385df1d3,0,Great.,
10406,C_08c24252a78d48cd9a4cd400385df1d3,1,"Are you able to see the entire ad? It's a white Toyota Prius C Two Hatchback, 4D, automatic.It also has a lot of other cool features like cruise control and bluetooth.",
10407,C_08c24252a78d48cd9a4cd400385df1d3,0,Yes. Would you accept $8000 for it?,
10408,C_08c24252a78d48cd9a4cd400385df1d3,1,"It's a little low for me, I can accept $8200.",
10409,C_08c24252a78d48cd9a4cd400385df1d3,0,Okay. Deal.,
10410,C_08c24252a78d48cd9a4cd400385df1d3,1,Perfect.,
10575,C_627e56b96ba246bb9e791197bf4dab6b,0,Hello,
10576,C_627e56b96ba246bb9e791197bf4dab6b,1,"Hello, how are you doing today. My wife and I just bought this bed and we have to relocate immediately and cannot take the bed with us. I am offering it for $900",
10577,C_627e56b96ba246bb9e791197bf4dab6b,0,"I see it's from IKEA right? Hmm, I am afraid it won't last for a long time",
