,Index,User,Text,Face acts
5147,C_fcee6c2aa5a247e78dd1a1afa938298f,0,I saw your ad for $15.  Do you give any discounts?,
5148,C_fcee6c2aa5a247e78dd1a1afa938298f,1,I am willing to negotiate however I do not tend to budge too much!,
5149,C_fcee6c2aa5a247e78dd1a1afa938298f,0,well I have $13 to spend,
5150,C_fcee6c2aa5a247e78dd1a1afa938298f,1,Ok what are we looking to fix with your computer?,
5151,C_fcee6c2aa5a247e78dd1a1afa938298f,0,I think It's the fan.  It went out but I don't think that it overheated the computer.,
5152,C_fcee6c2aa5a247e78dd1a1afa938298f,1,"Ok sounds good, that is slightly cheaper to fix, could you do fourteen. I will allow a discount on your next fix for five dollars off. How does that sound?",
5153,C_fcee6c2aa5a247e78dd1a1afa938298f,0,ok with the $5 off for my next visit -- that's fair,
5154,C_fcee6c2aa5a247e78dd1a1afa938298f,1,Sounds good! Thank you for your business!,
5185,C_f720094cbd7d4670908c6b0ebad57d5e,0,Hi!,
5186,C_f720094cbd7d4670908c6b0ebad57d5e,1,Hello. Any questions about the sofa?,
5187,C_f720094cbd7d4670908c6b0ebad57d5e,0,"Yes, was wondering how the condition of the sofa is. I've seen pictures and it doesn't seem as new",
5188,C_f720094cbd7d4670908c6b0ebad57d5e,1,It's in very good condition. We are a smoke-free house and don't own pets.,
5189,C_f720094cbd7d4670908c6b0ebad57d5e,0,"Ok, nice. And how much did you buy it for?",
5190,C_f720094cbd7d4670908c6b0ebad57d5e,1,I paid $600 for the set two years ago.,
5191,C_f720094cbd7d4670908c6b0ebad57d5e,0,"Ok, great. I was thinking maybe $280",
5192,C_f720094cbd7d4670908c6b0ebad57d5e,1,$300 and I'll throw in the ottoman we used with the loveseat.,
5193,C_f720094cbd7d4670908c6b0ebad57d5e,0,Sounds excellent!,
5194,C_f720094cbd7d4670908c6b0ebad57d5e,1,Great. Thanks for not low-balling the offer.,
5227,C_3c44ab824f224d94928edb943215b3fd,1,Hi,
5228,C_3c44ab824f224d94928edb943215b3fd,0,"Hi, Why are there so few pictures for this item?",
5229,C_3c44ab824f224d94928edb943215b3fd,1,I just have had some issues with my camera,
5230,C_3c44ab824f224d94928edb943215b3fd,0,Got it. So what's your favorite thing about this car?,
5231,C_3c44ab824f224d94928edb943215b3fd,1,"I think the smooth ride and handling, also the color is great , pearl white.",
5232,C_3c44ab824f224d94928edb943215b3fd,0,Okay. That's good to hear. What do you think about $5000 even for it. Of course you know that you priced it a bit high.,
5233,C_3c44ab824f224d94928edb943215b3fd,1,I researched and that is more than fair market value. I am willing to lower it but feel 5000 is too low.,
5234,C_3c44ab824f224d94928edb943215b3fd,0,"Well, it's a used car without a warranty. I can go a little bit higher than 5k, but I need a warranty.",
5235,C_3c44ab824f224d94928edb943215b3fd,1,"you are mistaken, there is a warranty.",
5236,C_3c44ab824f224d94928edb943215b3fd,0,What's the warranty? I don't see it in your advertisement,
5237,C_3c44ab824f224d94928edb943215b3fd,1,"It is a manufacturer warranty, good for 5 more years..",
5238,C_3c44ab824f224d94928edb943215b3fd,0,"Okay, well in that case, I feel quite a bit better about the fact that there aren't any pictures. How about an even 6000? I am going up a whole thousand more than I want to pay here, please budge for me!!!",
5239,C_3c44ab824f224d94928edb943215b3fd,1,alright for you I can do 6000.,
5240,C_3c44ab824f224d94928edb943215b3fd,0,FANTASTIC!!!,
5299,C_c6a45e6e9d624babbf8b5cdc008f7f36,1,"Hello, are you interested in this TV stand?",
5300,C_c6a45e6e9d624babbf8b5cdc008f7f36,0,Does it have scratches and is everything working good and solid on it?,
5301,C_c6a45e6e9d624babbf8b5cdc008f7f36,1,It's in great shape.,
5302,C_c6a45e6e9d624babbf8b5cdc008f7f36,0,How long is it?,
5303,C_c6a45e6e9d624babbf8b5cdc008f7f36,1,"It's made for a 55 inch tv, it's about 50 inches wide across the top",
5304,C_c6a45e6e9d624babbf8b5cdc008f7f36,0,Would you be willing to take $75 for it?,
5305,C_c6a45e6e9d624babbf8b5cdc008f7f36,1,"Well, it's in really good shape, the problem is my wife decided that we had to change out all of the furniture in our living room after 1 year of having it, because she's evidently deranged.",
5306,C_c6a45e6e9d624babbf8b5cdc008f7f36,0,Are you willing to negotiate on the price?,
5307,C_c6a45e6e9d624babbf8b5cdc008f7f36,1,"If you're willing to come and pick it up, I'd be willing to drop it down to $100.",
5308,C_c6a45e6e9d624babbf8b5cdc008f7f36,0,I could go $85.00.,
5309,C_c6a45e6e9d624babbf8b5cdc008f7f36,1,If I offer to throw in my crazy wife will it help you come up at all in price?,
5310,C_c6a45e6e9d624babbf8b5cdc008f7f36,0,No thanks. Just the TV stand at $85.00. You'd have to pay me to take her haha.,
5311,C_c6a45e6e9d624babbf8b5cdc008f7f36,1,"Hmm, well, I guess I don't have a choice, $85 it is.",
5312,C_88a63f6ffc7a4126a8a942274eee179c,1,Are you interested in the house?,
5313,C_88a63f6ffc7a4126a8a942274eee179c,0,I am but was wondering about the location. What is that close to?,
5314,C_88a63f6ffc7a4126a8a942274eee179c,1,"This home is located in a great part of town.  It is on a quiet cul de sac, but walking distance to the town center with shops and restaurants.  It is a safe walk too.  Lined with brand-new sidewalks all the way.",
5315,C_88a63f6ffc7a4126a8a942274eee179c,0,I wish you accepted pets and had a washer/dryer. Would you be willing to go $2200?,
5316,C_88a63f6ffc7a4126a8a942274eee179c,1,"No, sorry, too low.  There is a washer/dryer hook up.",
5317,C_88a63f6ffc7a4126a8a942274eee179c,0,I don't have a washer or dryer. The place I'm at now included it. Who takes care of the lawn/landscaping?,
5318,C_88a63f6ffc7a4126a8a942274eee179c,1,We have a service comes once a month for the lawn and bushes.,
5319,C_88a63f6ffc7a4126a8a942274eee179c,0,I could go $2500 if you can include a washer/dryer but that's the best I can do.,
5320,C_88a63f6ffc7a4126a8a942274eee179c,1,"I have a couple coming to view the property today.  If you could do 2800 the property is yours, but otherwise I'll have to wait until after the viewing.",
5321,C_88a63f6ffc7a4126a8a942274eee179c,0,I can do $2600 with the washer/dryer but that is a stretch.,
5322,C_88a63f6ffc7a4126a8a942274eee179c,1,I have other business to tend to so I'll tell you what...I'll take 2600 but no washer dryer.,
5323,C_88a63f6ffc7a4126a8a942274eee179c,0,$2550 and that will leave me enough to rent a washer/dryer?,
5324,C_88a63f6ffc7a4126a8a942274eee179c,1,Ok... you got a good deal.,
5361,C_94e2687ca8df42e99d31ff02d4d4a80f,0,Hello is this item still for sale?,
5362,C_94e2687ca8df42e99d31ff02d4d4a80f,1,"yes hi , it's a perfect bike",
5363,C_94e2687ca8df42e99d31ff02d4d4a80f,0,Can you tell me a little about it?,
5364,C_94e2687ca8df42e99d31ff02d4d4a80f,1,"it's a light bike, easy to handle, fairly new, pro-bike, it's like no other bike, you should come and ride it if you don't believe me,",
5365,C_94e2687ca8df42e99d31ff02d4d4a80f,0,What are you asking?,
5366,C_94e2687ca8df42e99d31ff02d4d4a80f,1,I ll let it go for 2600,
5367,C_94e2687ca8df42e99d31ff02d4d4a80f,0,Are the tires in good shape?,
5368,C_94e2687ca8df42e99d31ff02d4d4a80f,1,yes they are in perfect shape,
5369,C_94e2687ca8df42e99d31ff02d4d4a80f,0,Will you take 2000?,
5370,C_94e2687ca8df42e99d31ff02d4d4a80f,1,"I will take 2400 and I will deliver it , how about that ?",
5371,C_94e2687ca8df42e99d31ff02d4d4a80f,0,Will you do 2200 and I will come pick it up since its a 100 mile drive?  It will save you on gas.,
5372,C_94e2687ca8df42e99d31ff02d4d4a80f,1,"i think i could that, only if you come tomorrow morning, because i might change my mind,fair enough ?",
5373,C_94e2687ca8df42e99d31ff02d4d4a80f,0,Good deal. agree,
5394,C_0150d45a7290453fa35102b4f2539918,0,hello how we doing today,
5395,C_0150d45a7290453fa35102b4f2539918,1,Hi there.,
5396,C_0150d45a7290453fa35102b4f2539918,1,I'm okay and you?,
5397,C_0150d45a7290453fa35102b4f2539918,0,"I really need this LG cable because I can't find them anymore,",
5398,C_0150d45a7290453fa35102b4f2539918,1,Well then I can solve your issue.  They're all original.,
5399,C_0150d45a7290453fa35102b4f2539918,0,"good to know, so how about 10 dollars and let's get this settled right now,",
5400,C_0150d45a7290453fa35102b4f2539918,1,I've listed these for 15 but I can negotiate. How about 13?,
5401,C_0150d45a7290453fa35102b4f2539918,0,"i think I will accept 13 only if you ship it to my address and you pay the two dollars shipping and handling, fair enough ?",
5402,C_0150d45a7290453fa35102b4f2539918,1,Yeah that sounds fair. I3 and I'll ship them to you today.,
5403,C_0150d45a7290453fa35102b4f2539918,0,nice doing business with you,
5506,C_d40d1c392c1249e8a07e6f90b8e4193a,1,how we doing today,
5507,C_d40d1c392c1249e8a07e6f90b8e4193a,0,"Hi, I am interested in your tahoe. can you tell me anything i need to know about this car",
5508,C_d40d1c392c1249e8a07e6f90b8e4193a,1,"it's my second tahoe, I like it but I don't need it anymore, it has all the luxuries inside and great for long distance,  no rips, new tires",
5509,C_d40d1c392c1249e8a07e6f90b8e4193a,0,how long have you personally owned this vehicle,
5510,C_d40d1c392c1249e8a07e6f90b8e4193a,1,10 years,
5511,C_d40d1c392c1249e8a07e6f90b8e4193a,0,"okay, great. I did not see in the ad, is this a manual or automatic?",
5512,C_d40d1c392c1249e8a07e6f90b8e4193a,1,"automatic , it's really great",
5513,C_d40d1c392c1249e8a07e6f90b8e4193a,0,"perfect. I am very interested in purchasing this vehicle, since this is a car you no longer need and since it is such high mileage are you willing to negotiate on the price. The listed price is just a little above my budget.",
5514,C_d40d1c392c1249e8a07e6f90b8e4193a,1,"ok we can work something out, what can you do",
5515,C_d40d1c392c1249e8a07e6f90b8e4193a,0,I'm concerned about any repairs and maintenance that I may have to do. I'm looking closer to the 2100.00 price range,
5516,C_d40d1c392c1249e8a07e6f90b8e4193a,1,"yeah it went for a full check up and it runs great, o you ok on that, but 2100 is way out of my range",
5517,C_d40d1c392c1249e8a07e6f90b8e4193a,0,"I'm not sure If I can do much more, while it looks great I would need to be able to take the car to a mechanic that I trust in order to go much higher than this. Without the most I could go is 2500",
5518,C_d40d1c392c1249e8a07e6f90b8e4193a,1,"ok it's you lucky day, but you have to come an pick it up, and cash only please, fair enough ?",
5519,C_d40d1c392c1249e8a07e6f90b8e4193a,0,"I can do cash, can we meet in the middle?",
5634,C_ecd38bebdde84cc48aee2ae5214e4ba8,0,Good morning.  Can you tell me about the mountain bike you have listed?,
5635,C_ecd38bebdde84cc48aee2ae5214e4ba8,1,"Sure. Shame to let it go because of how much I love it, but it's great if you wanna go downhill. It has a raceface handlebars and stem evolve, WTB seat, moto and cranks and Maxxis high roller tires.",
5636,C_ecd38bebdde84cc48aee2ae5214e4ba8,0,How long have you owned it for?   Are you the original owner?,
5637,C_ecd38bebdde84cc48aee2ae5214e4ba8,1,"That's right. It's mine only, and I've owned for about a few months give or take, so it's not in the worst condition at all. How much are we willing to negotiate?",
5638,C_ecd38bebdde84cc48aee2ae5214e4ba8,0,"Well, $800 is a bit higher than I'm willing to pay, but would you be willing to consider an offer of $650 if I were to come and pick it up?  Might save you a little bit of hassle....",
5639,C_ecd38bebdde84cc48aee2ae5214e4ba8,1,That s a lot lower than I hoped it would be. I want to sell it for $775 because of how close it is to that of a brand new bike in terms of quality.,
5640,C_ecd38bebdde84cc48aee2ae5214e4ba8,0,Hmmm....How about $725?,
5641,C_ecd38bebdde84cc48aee2ae5214e4ba8,1,"How about 750? $25 extra shouldn't be too far of a stretch from your current offer, no?",
5642,C_ecd38bebdde84cc48aee2ae5214e4ba8,0,Yeah.  OK.  I'll do $750 if you're willing to deliver it to me.  How about that?,
5643,C_ecd38bebdde84cc48aee2ae5214e4ba8,1,I'm willing to deliver to you! Sounds good to me!,
5683,C_01ac7239fef54abeb05a1e23c26b93e5,0,"Hello, I am interested in the cabinets you have listed.",
5684,C_01ac7239fef54abeb05a1e23c26b93e5,1,"Hi, the cabinets are brand new and unopened - they're great, but just don't fit in my kitchen.",
5685,C_01ac7239fef54abeb05a1e23c26b93e5,0,How long have you had them?,
5686,C_01ac7239fef54abeb05a1e23c26b93e5,1,"I bought them about 3 months ago, and still have the receipts.",
5687,C_01ac7239fef54abeb05a1e23c26b93e5,0,Okay. Do you know if Home Depot can still special order these cabinets?,
5688,C_01ac7239fef54abeb05a1e23c26b93e5,1,"Yes, they still carry the line so you should still be able to order them.",
5689,C_01ac7239fef54abeb05a1e23c26b93e5,0,"Okay, great! I am actually looking for four of them. Does this come with the hardware for them as well?",
5690,C_01ac7239fef54abeb05a1e23c26b93e5,1,"I have the hardware I purchased for them that I would be willing to throw in, I just need the space and to get these out of here!",
5691,C_01ac7239fef54abeb05a1e23c26b93e5,0,"Okay, I am very interested in the cabinets. You are a little bit of a drive for me, would you be willing to negotiate on the price a bit?",
5692,C_01ac7239fef54abeb05a1e23c26b93e5,1,"If you are within 20 miles of Oakland, I will deliver at no cost.",
5693,C_01ac7239fef54abeb05a1e23c26b93e5,0,"I'm actually not, I am about 42 miles one way.",
5694,C_01ac7239fef54abeb05a1e23c26b93e5,1,"Okay, I could go down to $70 - they are already quite discounted, and I will include the hardware.",
5695,C_01ac7239fef54abeb05a1e23c26b93e5,0,Would you be willing to do $65,
5696,C_01ac7239fef54abeb05a1e23c26b93e5,1,"Not with the hardware included, $70 is as low as I can go.",
5697,C_01ac7239fef54abeb05a1e23c26b93e5,0,Could you do the $65 without the hardware?,
5698,C_01ac7239fef54abeb05a1e23c26b93e5,1,"Yes, that's fine.",
5699,C_01ac7239fef54abeb05a1e23c26b93e5,0,"Okay, you got yourself a deal.",
5700,C_eb1f15e8e781463eba1aaddf70bf34e5,0,Hello do you still have this car?,
5701,C_eb1f15e8e781463eba1aaddf70bf34e5,1,Yes!  It is still available and I'm interested in selling!  :),
5702,C_eb1f15e8e781463eba1aaddf70bf34e5,0,Can you tell me anything about it,
5703,C_eb1f15e8e781463eba1aaddf70bf34e5,1,"I am the original owner, bought it new in 2006.  Great vehicle - has never left me stranded.  The interior is nearly pristine and the exterior looks very good (some dings like you would expect from an 11 year old vehicle).  Still drives great.  Only 85,000 miles.",
5704,C_eb1f15e8e781463eba1aaddf70bf34e5,0,"Ok, how much are you asking?",
5705,C_eb1f15e8e781463eba1aaddf70bf34e5,1,I'm asking $7800.  I bought a new Escalade and no longer need this one.,
5706,C_eb1f15e8e781463eba1aaddf70bf34e5,0,"Ok, I will offer you 4600 for it.",
5707,C_eb1f15e8e781463eba1aaddf70bf34e5,1,"Uh, no.  Book on it is $8300.  I'm already below that.  I'd be willing to consider an offer that is more reasonable, but $4600 is over three-thousand below my asking price.",
5708,C_eb1f15e8e781463eba1aaddf70bf34e5,0,Well to be honest I found the same care with less miles for cheaper.  If oyu are willing to throw in a warranty and deliver it for me I will offer more.,
5709,C_eb1f15e8e781463eba1aaddf70bf34e5,1,"OK, I can offer a 1 year warranty and will bring it to you, but I need you to make an offer.",
5710,C_eb1f15e8e781463eba1aaddf70bf34e5,0,Best I can go is 6900,
5711,C_eb1f15e8e781463eba1aaddf70bf34e5,1,Make it an even $7000 and you have a deal.,
5785,C_b512167e21b84e95be33990a2a008ea6,1,Good morning,
5786,C_b512167e21b84e95be33990a2a008ea6,0,Hi there. Nice bike. How many miles are on it?,
5787,C_b512167e21b84e95be33990a2a008ea6,1,Just under 100.  The odometer I bought with it shows 97.,
5788,C_b512167e21b84e95be33990a2a008ea6,0,Okay. Does it work well?,
5789,C_b512167e21b84e95be33990a2a008ea6,1,"Yes, there are no issues with the bike and it has always been kept in the garage when it isn't being ridden.",
5790,C_b512167e21b84e95be33990a2a008ea6,0,Great. That's good to know. I'm interested but 350 is a pretty steep price for a bike that's over 20 years old.,
5791,C_b512167e21b84e95be33990a2a008ea6,1,"Ok, well, it is in great condition, but I am willing to bargain",
5792,C_b512167e21b84e95be33990a2a008ea6,0,Okay. I can take it off your hands today for 300. I can pick it up myself.,
5793,C_b512167e21b84e95be33990a2a008ea6,1,I think $300 is completely reasonable.,
5794,C_b512167e21b84e95be33990a2a008ea6,0,Awesome. I'll email you with the time,
5920,C_63ef7a9074e44187900b6fb66037de94,1,I've got a gently used iPad 2 for sale. 32gb and I'll throw in a leather case for you,
5921,C_63ef7a9074e44187900b6fb66037de94,0,I'd like to offer you $122 for the ipad,
5922,C_63ef7a9074e44187900b6fb66037de94,1,I can't go that low. It's barely used. I'll do $175.,
5923,C_63ef7a9074e44187900b6fb66037de94,0,"when you say gently used, what exactly do you mean?",
5924,C_63ef7a9074e44187900b6fb66037de94,1,It's less than 8 months old. No noticeable wear on it. Used for about 5 hours a week.,
5925,C_63ef7a9074e44187900b6fb66037de94,0,I feel like $175 is way too high though.,
5926,C_63ef7a9074e44187900b6fb66037de94,1,A brand new iPad 2 would cost you $400,
5927,C_63ef7a9074e44187900b6fb66037de94,1,Are you looking to buy an iPad 2?,
5928,C_63ef7a9074e44187900b6fb66037de94,0,yes definitely,
5929,C_63ef7a9074e44187900b6fb66037de94,1,I've got one... barely used. I can sell it to you for $175. A brand new one would cost you $400.,
5930,C_63ef7a9074e44187900b6fb66037de94,0,yes but I can find a used one for 150 or less.. would you be willing to do 140,
5931,C_63ef7a9074e44187900b6fb66037de94,1,No. The lowest I can go is $170.,
5932,C_63ef7a9074e44187900b6fb66037de94,0,how about 160,
5933,C_63ef7a9074e44187900b6fb66037de94,1,Meet me at $165 and you've got a deal. A GREAT deal.,
5934,C_63ef7a9074e44187900b6fb66037de94,0,okay,
5995,C_567819db54474a99acb05cef818afddd,1,Hello there,
5996,C_567819db54474a99acb05cef818afddd,0,hello,
5997,C_567819db54474a99acb05cef818afddd,1,You looking at getting a lease?,
5998,C_567819db54474a99acb05cef818afddd,0,looking to buy,
5999,C_567819db54474a99acb05cef818afddd,1,"Oh, we're just renting out this home.",
6000,C_567819db54474a99acb05cef818afddd,0,I see. 3000 is a little high,
6001,C_567819db54474a99acb05cef818afddd,1,"It's san francisco after all. And the neighborhood is very good.  I can give you a month free, but I can't really lower the price.",
6002,C_567819db54474a99acb05cef818afddd,0,Is this a good neighborhood? I dont want to live around a bunch of crackheads.,
6003,C_567819db54474a99acb05cef818afddd,1,"Just a homosexual every now and then. ;-; The buses are close by, making transportation way smoother.",
6004,C_567819db54474a99acb05cef818afddd,0,how about 2900 and the free month of rent?,
6005,C_567819db54474a99acb05cef818afddd,1,I guess that'll work.,
6020,C_76d72ad506a740038fbe29b23432a79b,0,Hello! The table is beautiful but a bit far from my location. I'd be happy to pay full price if you would be willing to deliver.,
6021,C_76d72ad506a740038fbe29b23432a79b,1,"Hi, I had asked for a phone number in reply but since you are here now we can chat this way instead.",
6022,C_76d72ad506a740038fbe29b23432a79b,0,Sounds good. Do you think you would be able to deliver?,
6023,C_76d72ad506a740038fbe29b23432a79b,1,That depends how far you are exactly? are we talking 20 miles or how far?,
6024,C_76d72ad506a740038fbe29b23432a79b,0,Based on the Google maps I am approximately 17.3 miles out.,
6025,C_76d72ad506a740038fbe29b23432a79b,1,"Alright, it is not too far but I have another offer now, for someone to come pick it up like I had specified in the ad",
6026,C_76d72ad506a740038fbe29b23432a79b,0,Well darn. I really love the table but it just won't fit in my smartcar. I swear those cars just aren't so smart after all. :-(,
6027,C_76d72ad506a740038fbe29b23432a79b,1,Ha that is funny.. sorry I really wanted cash and pick up. Do you have friend who has abigger car?,
6028,C_76d72ad506a740038fbe29b23432a79b,0,No. But I would be happy to throw in a 12 pack of beer that I have here at the house to make up the difference. It's Alaska White. Have you had it? It's fantabulous!,
6029,C_76d72ad506a740038fbe29b23432a79b,1,"I have not, but you seem fun, so I will make an exception for you.",
6030,C_76d72ad506a740038fbe29b23432a79b,0,Wonderful! You are an angel sent from heaven. I'll send the money now!,
6031,C_398db450bb084483818f4fc869c0d396,1,Hi there,
6032,C_398db450bb084483818f4fc869c0d396,0,hello how you doing,
6033,C_398db450bb084483818f4fc869c0d396,1,"Good, are you contacting me about the circuit breakers?",
6034,C_398db450bb084483818f4fc869c0d396,0,yeah how much are you asking for it,
6035,C_398db450bb084483818f4fc869c0d396,1,110,
6036,C_398db450bb084483818f4fc869c0d396,0,that seems expensive,
6037,C_398db450bb084483818f4fc869c0d396,1,"Well if you read over the ad, they are brand new.  They are older but quality",
6038,C_398db450bb084483818f4fc869c0d396,0,i do know they are brand new but i think i can find the same for around 90 on other sites,
6039,C_398db450bb084483818f4fc869c0d396,1,ok well if you want to do 90 I am ok with going down to there,
6040,C_398db450bb084483818f4fc869c0d396,0,ok sounds good to me,
6123,C_3a9f4bf599b04365ae5acbc1314a87be,0,Hi I am interested in the rental.,
6124,C_3a9f4bf599b04365ae5acbc1314a87be,1,Hey there. The rental is still available. Any questions?,
6125,C_3a9f4bf599b04365ae5acbc1314a87be,0,Yes is it non smoking or not? also what is the pet policy?,
6126,C_3a9f4bf599b04365ae5acbc1314a87be,1,It is no smoking and pets are allowed with a deposit.,
6127,C_3a9f4bf599b04365ae5acbc1314a87be,0,what is the deposit amount?,
6128,C_3a9f4bf599b04365ae5acbc1314a87be,1,The pet deposit is $700.,
6129,C_3a9f4bf599b04365ae5acbc1314a87be,0,oh wow! even for a cat?That is a lot!,
6130,C_3a9f4bf599b04365ae5acbc1314a87be,1,"It's the cover any possible damages. If the place is kept in good condition (no pet stains, scratches, etc) then you get the deposit back.",
6131,C_3a9f4bf599b04365ae5acbc1314a87be,0,fair enough. do you think you could come down some in rent then?,
6132,C_3a9f4bf599b04365ae5acbc1314a87be,1,"I can only negotiate a little bit because that is a fair market price, do you have an offer?",
6133,C_3a9f4bf599b04365ae5acbc1314a87be,0,1100?,
6134,C_3a9f4bf599b04365ae5acbc1314a87be,1,Whoa that is way too low. It's avery at towncentre and you wont find that price in this neighborhood. This is a great community.,
6135,C_3a9f4bf599b04365ae5acbc1314a87be,0,"I understand that , I am a single parent trying to do the best I can. 1300?",
6136,C_3a9f4bf599b04365ae5acbc1314a87be,1,Okay I can help you a little bit because of your situation. How about 1900?,
6137,C_3a9f4bf599b04365ae5acbc1314a87be,0,it is listed for 1860.. 1900 is above listing!,
6159,C_221bd6579e4f4cc09ec5cfce2ac1640e,0,Hi,
6160,C_221bd6579e4f4cc09ec5cfce2ac1640e,1,How are you.  This is a steal for $3450.,
6161,C_221bd6579e4f4cc09ec5cfce2ac1640e,0,How old is it?,
6162,C_221bd6579e4f4cc09ec5cfce2ac1640e,1,2007,
6163,C_221bd6579e4f4cc09ec5cfce2ac1640e,0,so ten years.. how is it holding up condition wise?,
6164,C_221bd6579e4f4cc09ec5cfce2ac1640e,1,It's in excellent condition.  It was built for the Russian Olympic Team so it has a collectors value,
6165,C_221bd6579e4f4cc09ec5cfce2ac1640e,0,"I am on a bit of a budget, I know it is a great item but would you be willing to take 3105?",
6166,C_221bd6579e4f4cc09ec5cfce2ac1640e,1,"I can't go that low, but how about $3300.  I can include videos of the Russian team and a COA.",
6167,C_221bd6579e4f4cc09ec5cfce2ac1640e,0,"That is a little high, could you deliver?",
6168,C_221bd6579e4f4cc09ec5cfce2ac1640e,1,I will be happy to deliver to you.,
6169,C_221bd6579e4f4cc09ec5cfce2ac1640e,0,okay let's make a deal then..,
6349,C_6d0907afaa864f8db2683db3c0e730ff,0,hi your home is really beautiful,
6350,C_6d0907afaa864f8db2683db3c0e730ff,1,Are you interested in the cottage?,
6351,C_6d0907afaa864f8db2683db3c0e730ff,0,"yes i am, but the price is out of my current budget, are you willing to lower it to 2450",
6352,C_6d0907afaa864f8db2683db3c0e730ff,1,"I really can't go down that low $3,500 is a fair price can you make a serious offer?",
6353,C_6d0907afaa864f8db2683db3c0e730ff,0,"i was being serious, i mean it doesn't come with electric so i think my offer is pretty reasonable",
6354,C_6d0907afaa864f8db2683db3c0e730ff,1,Actually the guest cottage is the one that doesn't have any electricity if you look at the listing.,
6355,C_6d0907afaa864f8db2683db3c0e730ff,0,"ok 2800 can you work with that?, if i bring my own furniture",
6356,C_6d0907afaa864f8db2683db3c0e730ff,1,"That's still too low. How about $3,200",
6357,C_6d0907afaa864f8db2683db3c0e730ff,0,3000 then we have a deal,
6358,C_6d0907afaa864f8db2683db3c0e730ff,1,3100 and we have a deal,
6412,C_c3f97b49c70b44e982fa18827b729966,0,Hi are you still selling the batteries?,
6413,C_c3f97b49c70b44e982fa18827b729966,1,"Yes, I certainly am.",
6414,C_c3f97b49c70b44e982fa18827b729966,0,The listing says that they are gently used how long have they been used?,
6415,C_c3f97b49c70b44e982fa18827b729966,1,"Less than 2 months, about 6 weeks",
6416,C_c3f97b49c70b44e982fa18827b729966,0,How much life do the batteries have left?,
6417,C_c3f97b49c70b44e982fa18827b729966,1,"The full life, I've not used them more than twice. I just didn't like them.",
6418,C_c3f97b49c70b44e982fa18827b729966,0,What didn't you like about the batteries are they no good?,
6419,C_c3f97b49c70b44e982fa18827b729966,1,"No, they're awesome! I just don't have a lot of time to fly the drone and not a lot of interest in it.",
6420,C_c3f97b49c70b44e982fa18827b729966,0,Oh okay would you take $120 for them?,
6421,C_c3f97b49c70b44e982fa18827b729966,1,"Yes, that works fine for me",
6432,C_0e9bc20920e04c858e9c9f5e27741435,0,Hello are you still selling the T3,
6433,C_0e9bc20920e04c858e9c9f5e27741435,1,Yes it is still for sale. Are you interested in it?,
6434,C_0e9bc20920e04c858e9c9f5e27741435,0,Yes I'm interested in it. Can you tell me if it's in good condition?,
