,Index,User,Text,Face acts
4770,C_0175e2ed1d5c4a4aa96c9d97e6e700b1,0,Good evening! I'm very impressed with your offer of the home in Pittsburg. Could you tell me if it's close to any grocery store or schools?,
4771,C_0175e2ed1d5c4a4aa96c9d97e6e700b1,1,"You will have your pick of markets to choose from as you can walk to many. Well within walking distance of daily farmer's markets and food festivals. The elementary and middle schools are also within walking distance, but the high school requires transportation.",
4772,C_0175e2ed1d5c4a4aa96c9d97e6e700b1,0,That shouldn't be an issue as my son has his license. What types of restaurants are near?,
4773,C_0175e2ed1d5c4a4aa96c9d97e6e700b1,1,Local favorites such as Primanti Bros. and Peppi's offering sandwiches along with meals. Plenty of seafood choices as well.,
4774,C_0175e2ed1d5c4a4aa96c9d97e6e700b1,0,That's great. I'm excited about the large master and oversized shower. Are you willing to lower the price a little?,
4775,C_0175e2ed1d5c4a4aa96c9d97e6e700b1,1,"My favorite parts of the house. Sure. How about $2,000?",
4776,C_0175e2ed1d5c4a4aa96c9d97e6e700b1,0,"I was thinking closer to $1,200. I'll have to bring my own washer and dryer to hook up and the fridge isn't included.",
4777,C_0175e2ed1d5c4a4aa96c9d97e6e700b1,1,"That's just in the photos. We recently got a new one. Would be willing to do $1,900 and leave the furniture. Already have an offer for $1,800 as is.",
4778,C_0175e2ed1d5c4a4aa96c9d97e6e700b1,0,"But the description says that even though the fridge is in the photos, it's not included. Are you saying there is a fridge now?",
4779,C_0175e2ed1d5c4a4aa96c9d97e6e700b1,1,"Sorry, read that wrong. There is no fridge.",
4780,C_0175e2ed1d5c4a4aa96c9d97e6e700b1,0,"Okay. Are you willing to put a fridge in or do I need to bring one? that will cost around $500. I'm willing to do $1,300",
4781,C_0175e2ed1d5c4a4aa96c9d97e6e700b1,1,"I would be willing, but not for $1,300. The lowest I could go is 1,850 with no furniture left behind.",
4782,C_0175e2ed1d5c4a4aa96c9d97e6e700b1,0,"$1,600 is as high as I am willing to go. I don't need furniture, and it's only 3 bedrooms, plus I'll need to cover utilities",
4783,C_0175e2ed1d5c4a4aa96c9d97e6e700b1,1,"Sorry, already have an offer for $1,800. That's my final offer.",
4795,C_6cea45c6b91f4aac94a39ca416ab9619,0,Hey that seems to be a nice bike,
4796,C_6cea45c6b91f4aac94a39ca416ab9619,1,It is a very nice bike. Can I answer any questions you may have?,
4797,C_6cea45c6b91f4aac94a39ca416ab9619,0,Well any issue with the bike missing pedals or parts and pieces?,
4798,C_6cea45c6b91f4aac94a39ca416ab9619,1,All the parts and pedals are in good working condition. This bike has hardly been rode.,
4799,C_6cea45c6b91f4aac94a39ca416ab9619,0,I see well lets get into it then now the bike is 3 years so I was thinking your current price is a bit too steep,
4800,C_6cea45c6b91f4aac94a39ca416ab9619,1,I would be willing to knock $200 of the price.,
4801,C_6cea45c6b91f4aac94a39ca416ab9619,0,Well I was thinking of offering $1320,
4802,C_6cea45c6b91f4aac94a39ca416ab9619,1,I don't think I could go that low. I could do $1750 if you came and picked up the bike.,
4803,C_6cea45c6b91f4aac94a39ca416ab9619,0,Well do you have anything you could throw in to make the 17500 a little more encouraging you have to consider the age and also its lack of use there could be parts that are seezing or rusty. Actually what is the condition of the tires and chain,
4804,C_6cea45c6b91f4aac94a39ca416ab9619,1,I have been riding bikes for several years and I keep this bike in good working order. Since this bike has been upgraded quite a bit I think that would be worth the price since it would keep you from having to upgrade it yourself.,
4805,C_6cea45c6b91f4aac94a39ca416ab9619,0,ok can I get you to come down to 1600,
4806,C_6cea45c6b91f4aac94a39ca416ab9619,1,I could do that.,
4807,C_6cea45c6b91f4aac94a39ca416ab9619,0,Thanks I'd appreciate that.,
4863,C_bb7be7db9128466cac7405e7a1699b10,0,hi,
4864,C_bb7be7db9128466cac7405e7a1699b10,1,Hi there.  This will be great as a subwoofer amp. Interested?,
4865,C_bb7be7db9128466cac7405e7a1699b10,0,how much i can aford $130,
4866,C_bb7be7db9128466cac7405e7a1699b10,1,I'm selling it for $275.,
4867,C_bb7be7db9128466cac7405e7a1699b10,0,come on can i get a better deal than than that $175,
4868,C_bb7be7db9128466cac7405e7a1699b10,1,"This is a really good brand name, but because it does need to be re-capped I'll offer 225.",
4869,C_bb7be7db9128466cac7405e7a1699b10,0,is soemthing wrong with it,
4870,C_bb7be7db9128466cac7405e7a1699b10,1,"Yeah, it doesn't work as well as it should because it doesn't have the cap. But it still works. I paid over 1000 for this brand new.",
4871,C_bb7be7db9128466cac7405e7a1699b10,0,in that case i can offer you 125,
4872,C_bb7be7db9128466cac7405e7a1699b10,1,125 is too low. I'm willing to go as low as 200,
4873,C_bb7be7db9128466cac7405e7a1699b10,0,how about $190 and i'll pick it up at 7pm,
4874,C_bb7be7db9128466cac7405e7a1699b10,1,Okay it's a deal. 190,
4875,C_bb7be7db9128466cac7405e7a1699b10,0,thanks,
4896,C_858441e17e0948c6a2db3e1234ccc31e,0,nice lookin bike,
4897,C_858441e17e0948c6a2db3e1234ccc31e,1,thanks its really sturdy and only rode it once,
4898,C_858441e17e0948c6a2db3e1234ccc31e,0,oh how much you asking,
4899,C_858441e17e0948c6a2db3e1234ccc31e,1,650,
4900,C_858441e17e0948c6a2db3e1234ccc31e,0,how about 400,
4901,C_858441e17e0948c6a2db3e1234ccc31e,1,no i really cant I just got the bike like a day ago now its practically NEW only rode once Im already losing a 100 bucks by selling this at 650,
4902,C_858441e17e0948c6a2db3e1234ccc31e,0,i can offer you $550 does that sound better,
4903,C_858441e17e0948c6a2db3e1234ccc31e,1,The best I can do is 640,
4904,C_858441e17e0948c6a2db3e1234ccc31e,0,let me see if the old lady will lone me a few bucks,
4905,C_858441e17e0948c6a2db3e1234ccc31e,1,ok but this is my final offer,
4906,C_858441e17e0948c6a2db3e1234ccc31e,0,$640 it is can you bring it to starbucks at 5pm,
4907,C_858441e17e0948c6a2db3e1234ccc31e,1,sure can thanks,
4908,C_858441e17e0948c6a2db3e1234ccc31e,0,thanks,
4909,C_41e2a5cc40e5447bb5d62f3be9040bef,0,Hello,
4910,C_41e2a5cc40e5447bb5d62f3be9040bef,1,"Hello, How are you today?",
4911,C_41e2a5cc40e5447bb5d62f3be9040bef,0,"I'm good. I really like the location of the room, are you willing to work some on the price?",
4912,C_41e2a5cc40e5447bb5d62f3be9040bef,1,"I would be willing to be a little flexible. There has been good interest so far, but for the right student, I would make a deal",
4913,C_41e2a5cc40e5447bb5d62f3be9040bef,0,"Don't have to worry about late nights or problems from me. I'm going to school full time and working 20 hours a week, so won't even be there much. Would you be willing to go down to $1,100?",
4914,C_41e2a5cc40e5447bb5d62f3be9040bef,1,"Oh, that sounds like a very busy schedule. With $1100, I don't think I would be able to cover the cost of utilities. Did you see that they were fully included? If you are able to sign a lease today, I could do $1275",
4915,C_41e2a5cc40e5447bb5d62f3be9040bef,0,"I'd be willing to work a few hours of maintenance each week if you could go $1,150. That's as high as I can go.",
4916,C_41e2a5cc40e5447bb5d62f3be9040bef,1,"Can you talk about your maintenance experience? With a full time class load and 20 hours of week elsewhere, what type of time do you think you would have to dedicate to work here?",
4917,C_41e2a5cc40e5447bb5d62f3be9040bef,0,"I've worked for a landscaping company every summer for 4 years. My father is a contractor,  and I've also worked with him.  My job is all weekdays, so my weekends would be open.",
4918,C_41e2a5cc40e5447bb5d62f3be9040bef,1,"How about 1250. You are responsible for 6 hours of work a month assigned by the property manager. That works out to a rate of about $25.00 discount, but you would be responsible for paying the full balance if you are not able to complete the work. If you are a good employee, I think we could consider additional hours,and further reduction after a trial period.",
4919,C_41e2a5cc40e5447bb5d62f3be9040bef,0,I just don't think I can afford that.,
4920,C_3fa8726d330440bb8ace32ba5595999a,0,"Hello, is there a weight restriction on this tractor?",
4921,C_3fa8726d330440bb8ace32ba5595999a,1,"no, there is no weight restriction listed.",
4922,C_3fa8726d330440bb8ace32ba5595999a,0,What year was this manufactured?,
4923,C_3fa8726d330440bb8ace32ba5595999a,1,This is a used tractor in mint condition.  I'm sorry that I do not have the year it was manufactured.  Are you looking to purchase a tractor for your child?,
4924,C_3fa8726d330440bb8ace32ba5595999a,0,Yes I am. Do you know how much this trator has been used?,
4925,C_3fa8726d330440bb8ace32ba5595999a,1,"Per the picture, it has been gently used.  It is in mint condition, i.e. very good condition.",
4926,C_3fa8726d330440bb8ace32ba5595999a,0,Since there seems to be alot of unknowns with this item would you be willing to accept $322?,
4927,C_3fa8726d330440bb8ace32ba5595999a,1,I would be willing to take $25 off the original price of $350 to cover the unknowns.,
4928,C_3fa8726d330440bb8ace32ba5595999a,1,Making the purchase price $325 and I will include free shipping.,
4929,C_3fa8726d330440bb8ace32ba5595999a,0,That sounds like a fair trade to me.,
4930,C_3fa8726d330440bb8ace32ba5595999a,1,Great!  I will go ahead and accept the $325 then.,
4951,C_237722e1e106441899ed7b22ab02adc0,0,Hi there! I see you have an apartment for rent!,
4952,C_237722e1e106441899ed7b22ab02adc0,1,Yes I do. The price is $2525 a month.,
4953,C_237722e1e106441899ed7b22ab02adc0,0,"Oh wow, that seems a little pricy. Might I ask what kind of ammentities you offer?",
4954,C_237722e1e106441899ed7b22ab02adc0,1,"There are one and two bedroom apts to choose from, as well as private patios and spacious closets. We also have a beautiful clubhouse.",
4955,C_237722e1e106441899ed7b22ab02adc0,0,Is there a pool or gym included?,
4956,C_237722e1e106441899ed7b22ab02adc0,1,eeeThere is an olympic sized pool and a gym that includes a sauna and a spa.,
4957,C_237722e1e106441899ed7b22ab02adc0,0,"While of that sounds absolutely wonderful, would you be interested in $1500 a month?",
4958,C_237722e1e106441899ed7b22ab02adc0,1,"Well that depends, would you be looking to rent a one or two bedroom?",
4959,C_237722e1e106441899ed7b22ab02adc0,0,It is the two bedroom I am interested in.,
4960,C_237722e1e106441899ed7b22ab02adc0,1,How many adults and how many children would be on the lease?,
4961,C_237722e1e106441899ed7b22ab02adc0,0,"It would be two adults, that is all.",
4962,C_237722e1e106441899ed7b22ab02adc0,1,"I have one of the smaller two bedrooms available with only one bath instead of the one and a half, for 1875 per month. However the parking is not covered, and it is a 2nd story unit.",
4963,C_237722e1e106441899ed7b22ab02adc0,0,That sounds like a good location. How about 1600?,
4964,C_237722e1e106441899ed7b22ab02adc0,1,I have a one bedroom at that price point. The two bedrooms are not less than 1800 per month. That is as low as we are allowed to offer them at.,
4965,C_237722e1e106441899ed7b22ab02adc0,0,"Alright, I can accept the 1800.",
4966,C_237722e1e106441899ed7b22ab02adc0,1,Wonderful. Let me submit your offer and then we can start the paperwork...,
5032,C_8cea1e8f9a9a41068a3f1ddcec3b49cf,0,hello,
5033,C_8cea1e8f9a9a41068a3f1ddcec3b49cf,1,Hello you interested in the computer?,
5034,C_8cea1e8f9a9a41068a3f1ddcec3b49cf,0,I am interested in getting repairs done to my phone,
5035,C_8cea1e8f9a9a41068a3f1ddcec3b49cf,1,ok I do both computer repairs and phone repairs.,
5036,C_8cea1e8f9a9a41068a3f1ddcec3b49cf,0,"Ok, I just need my phone's screen replaced. I have the screen already just can't do it myself.",
5037,C_8cea1e8f9a9a41068a3f1ddcec3b49cf,1,ok well I can do that for you for $15,
5038,C_8cea1e8f9a9a41068a3f1ddcec3b49cf,0,"Ok, I can offer you $9",
5039,C_8cea1e8f9a9a41068a3f1ddcec3b49cf,1,"I can take $5 off since you're a new customer, making it cheap at $10",
5040,C_8cea1e8f9a9a41068a3f1ddcec3b49cf,0,"Ok, sounds like a great deal. thank you",
5041,C_8cea1e8f9a9a41068a3f1ddcec3b49cf,1,I said $10 dollars not $9.,
5042,C_8cea1e8f9a9a41068a3f1ddcec3b49cf,0,"Yes I realized I entered 9 on accident when you'd said 10 lol, I am sorry",
5043,C_8cea1e8f9a9a41068a3f1ddcec3b49cf,1,Well if you promise to refer customers to me I will give you the additional $1 off,
5044,C_8cea1e8f9a9a41068a3f1ddcec3b49cf,0,"Ok, I do have a friend that plans to come with me and schedule a repair as well. Again I am sorry about entering the wrong number",
5045,C_8cea1e8f9a9a41068a3f1ddcec3b49cf,1,not a problem.,
5080,C_0ffcdaf4686e42f291c671955ba89991,1,"Hello, looking for a bike",
5081,C_0ffcdaf4686e42f291c671955ba89991,0,Yes!,
5082,C_0ffcdaf4686e42f291c671955ba89991,1,Is it for you or your child?,
5083,C_0ffcdaf4686e42f291c671955ba89991,0,for my kids,
5084,C_0ffcdaf4686e42f291c671955ba89991,1,well this is a fully tuned up bike.  It would be really good for older kids.,
5085,C_0ffcdaf4686e42f291c671955ba89991,0,Wow!,
5086,C_0ffcdaf4686e42f291c671955ba89991,1,It's got a very comfortable ride and is very good for those long bike rides.  How much are you lookin to spend?,
5087,C_0ffcdaf4686e42f291c671955ba89991,0,some around 600,
5088,C_0ffcdaf4686e42f291c671955ba89991,1,Wow!  This bike i'm trying to sell for $1300 but I can go down on the price if you bring cash and pick it up.,
5089,C_0ffcdaf4686e42f291c671955ba89991,0,Okay! I would like to know final price,
5090,C_0ffcdaf4686e42f291c671955ba89991,1,How about $800?  That's $500 off.,
5091,C_0ffcdaf4686e42f291c671955ba89991,0,700 final price in cas and i will pick it up,
5092,C_0ffcdaf4686e42f291c671955ba89991,1,ok that's only $100 more then my original amount off.  And it is for your kids,
5093,C_0ffcdaf4686e42f291c671955ba89991,0,Ya so are yo ready to cell,
5094,C_0ffcdaf4686e42f291c671955ba89991,1,go ahead and put your offer in for $700,
5095,C_0ffcdaf4686e42f291c671955ba89991,0,Tank you,
5096,C_0ffcdaf4686e42f291c671955ba89991,1,"Sure, no problem.",
5108,C_52268c907f2f4e46acaeb6b3cf6b780a,0,"Hi, I'm interested in the headboard and footboard.  It's hard to tell by the picture but what color is the metal?  Gun metal?",
5109,C_52268c907f2f4e46acaeb6b3cf6b780a,1,It's similar to Antique brass!,
5110,C_52268c907f2f4e46acaeb6b3cf6b780a,0,Are there any dings or bends in either piece?,
5111,C_52268c907f2f4e46acaeb6b3cf6b780a,1,No dings or scratches! It's in excellent condition.,
5112,C_52268c907f2f4e46acaeb6b3cf6b780a,0,Cool.  Does a frame come with it?,
5113,C_52268c907f2f4e46acaeb6b3cf6b780a,1,The frame does not come with it! I'm sorry.,
5114,C_52268c907f2f4e46acaeb6b3cf6b780a,0,No problem.  What are you asking for both pieces?,
5115,C_52268c907f2f4e46acaeb6b3cf6b780a,1,i am asking $100,
5116,C_52268c907f2f4e46acaeb6b3cf6b780a,0,Would you be willing to break up the set?  My budget is tight and I can't afford 100 right now.,
5117,C_52268c907f2f4e46acaeb6b3cf6b780a,1,if you are willing to pick up tonight I can bring the price down to $85 and throw in a sheet and comforter set for you!,
5118,C_52268c907f2f4e46acaeb6b3cf6b780a,0,"Wow!  That sounds awesome.  I'll be able to pick it up tomorrow, is that ok?",
5119,C_52268c907f2f4e46acaeb6b3cf6b780a,1,Tomorrow works out great!,
5120,C_52268c907f2f4e46acaeb6b3cf6b780a,0,Great!  We've got a deal!!,
5155,C_5dc7626959b8484eb6c6ec88d0de0b10,0,Hey,
5156,C_5dc7626959b8484eb6c6ec88d0de0b10,1,Hi These adapters are in great condition.,
5157,C_5dc7626959b8484eb6c6ec88d0de0b10,0,Do you know if they are compatible with 16 mm film?,
5158,C_5dc7626959b8484eb6c6ec88d0de0b10,1,I have an adapter that I can throw in for free that will make it compatible.,
5159,C_5dc7626959b8484eb6c6ec88d0de0b10,0,Maybe they may work for some of my projects.  Do you think there is some room to negotiate?,
5160,C_5dc7626959b8484eb6c6ec88d0de0b10,1,What did you have in mind?,
5161,C_5dc7626959b8484eb6c6ec88d0de0b10,0,$30 ?,
5162,C_5dc7626959b8484eb6c6ec88d0de0b10,1,I can't go that low.  Do you have an old men's watch that you can add to the $30?,
5163,C_5dc7626959b8484eb6c6ec88d0de0b10,0,"yes, I have a vintage men's timex.",
5164,C_5dc7626959b8484eb6c6ec88d0de0b10,1,How old is it?,
5165,C_5dc7626959b8484eb6c6ec88d0de0b10,0,35 years..,
5166,C_5dc7626959b8484eb6c6ec88d0de0b10,1,Timexes aren't the greatest.  I am willing to take $40 & the watch for the adapters.,
5167,C_5dc7626959b8484eb6c6ec88d0de0b10,0,I would only do 30 with the watch or I could do 40 cash but no watch included.,
5168,C_5dc7626959b8484eb6c6ec88d0de0b10,1,I will take $40.,
5169,C_5dc7626959b8484eb6c6ec88d0de0b10,0,"alright, deal",
5170,C_5dc7626959b8484eb6c6ec88d0de0b10,1,thanks,
5241,C_e918b7a5c6324e7b9318dcb036feebbc,0,"Hi there,interested in your lamp.",
5242,C_e918b7a5c6324e7b9318dcb036feebbc,1,great! its still avaliable and can be picked up whenever. I'm asking $80 for it.,
5243,C_e918b7a5c6324e7b9318dcb036feebbc,0,do you smoke?,
5244,C_e918b7a5c6324e7b9318dcb036feebbc,1,"nope, lamp is from a smoke and pet free home",
5245,C_e918b7a5c6324e7b9318dcb036feebbc,0,"well that is important, can you tell me what type of silk the shade has on it?",
5246,C_e918b7a5c6324e7b9318dcb036feebbc,1,teal silk from Italy. I had the lampshade made out of a scarf I bought on a cruise. The lamp itself is less than 3 months old.,
5247,C_e918b7a5c6324e7b9318dcb036feebbc,0,that sounds lovely but I am on a budget. I was hoping we could negotiate the price down.,
5248,C_e918b7a5c6324e7b9318dcb036feebbc,1,"I'd be willing to take $60 but I'd have to take the lightbulbs out and replace them with basic bulbs,",
5249,C_e918b7a5c6324e7b9318dcb036feebbc,0,Could we do 55?,
5250,C_e918b7a5c6324e7b9318dcb036feebbc,1,sure,
5251,C_d8887513df8b4238b0c478d829fdb43a,0,"Hey, can you tell me a little more about the apartment's lease terms? Are they negotiable? I'm a Stanford student and we're on the quarter system, so I would need the lease to continue through the end of June instead of the end of May.",
5252,C_d8887513df8b4238b0c478d829fdb43a,1,I think we could work something out.  It's only a 30 day extension correct?,
5253,C_d8887513df8b4238b0c478d829fdb43a,0,"Yes, that's correct.",
5254,C_d8887513df8b4238b0c478d829fdb43a,1,Will you still want to move in August?,
5255,C_d8887513df8b4238b0c478d829fdb43a,0,Could I move in September instead? Our classes don't start until mid-September.,
5256,C_d8887513df8b4238b0c478d829fdb43a,1,September 1 to August 31 I could make that work.  Will it be just for yourself?,
5257,C_d8887513df8b4238b0c478d829fdb43a,0,"Awesome. I've got three Stanford friends with me, so they'd be in the other bedrooms and would also move in on September 1.",
5258,C_d8887513df8b4238b0c478d829fdb43a,1,ok.  will you be able to afford $1998 per person per month?,
5259,C_d8887513df8b4238b0c478d829fdb43a,0,"Honestly that amount is a lot more than I'm comfortable with, since I'm on student loans. But since you're willing to change up the lease terms regarding move-in and move-out date, I can be a little flexible. Could you do $7000 from all four of us, per month?",
5260,C_d8887513df8b4238b0c478d829fdb43a,1,I can do $7095 per month and all four of you will have to fill out a rental application.  I will go ahead and waive the $35 credit check for each person.  That will save you all $140 on the application process.,
5261,C_d8887513df8b4238b0c478d829fdb43a,0,Ok that works. Thanks so much.,
5262,C_d8887513df8b4238b0c478d829fdb43a,1,sure no problem,
5286,C_af6a2aec95b546388b85b5dd9c1625d9,0,Hi there! I am interested in this bike but your listing already says don't be one of those idiots and send me a low ball offer. So is there room for negotiation here?,
5287,C_af6a2aec95b546388b85b5dd9c1625d9,1,"Well, there's always an opportunity to negotiate.",
5288,C_af6a2aec95b546388b85b5dd9c1625d9,0,Great. So have you used the bike for a long time?,
5289,C_af6a2aec95b546388b85b5dd9c1625d9,1,"Yes, I've had it for 2 years.",
5290,C_af6a2aec95b546388b85b5dd9c1625d9,0,"Is the condition good? I mean, any scratches or scraps?",
5291,C_af6a2aec95b546388b85b5dd9c1625d9,1,"Well, I never rode it, it's a back up bike, so it's in good shape.",
5292,C_af6a2aec95b546388b85b5dd9c1625d9,0,Great. So would you accept $1840 for it?,
5293,C_af6a2aec95b546388b85b5dd9c1625d9,1,"I don't know if I could accept $1840, as I said in my listing it's worth every penny and much more.",
5294,C_af6a2aec95b546388b85b5dd9c1625d9,0,So what's the last you can go?,
5295,C_af6a2aec95b546388b85b5dd9c1625d9,1,"If you're willing to come by and pick it up, I'd let it go for $1900.",
5296,C_af6a2aec95b546388b85b5dd9c1625d9,0,Sure I can do that. Its absolutely not an issue for me! I would definitely accept this offer,
5297,C_af6a2aec95b546388b85b5dd9c1625d9,1,"Okay, great. I'll have the bike ready.",
5298,C_af6a2aec95b546388b85b5dd9c1625d9,0,Thanks,
5477,C_657cab1701bc4169adb70bf50b79def4,1,how we doing today,
5478,C_657cab1701bc4169adb70bf50b79def4,0,What floor in the apartment on?,
5479,C_657cab1701bc4169adb70bf50b79def4,1,"its th third, with really nice view of the park",
5480,C_657cab1701bc4169adb70bf50b79def4,0,Are utilities included?,
5481,C_657cab1701bc4169adb70bf50b79def4,1,no sorry but we can negotiate,
5482,C_657cab1701bc4169adb70bf50b79def4,0,I would like free cable TV.  Is that possible?,
5483,C_657cab1701bc4169adb70bf50b79def4,1,"yes I could throw in basic cable , is that fair enough",
5484,C_657cab1701bc4169adb70bf50b79def4,0,Basic cable is fair enough,
5485,C_657cab1701bc4169adb70bf50b79def4,1,ok so 2295 i good for you then ince your getting cable,
5486,C_657cab1701bc4169adb70bf50b79def4,0,Is there a swimming pool at the building?,
5487,C_657cab1701bc4169adb70bf50b79def4,1,we put it in demand and we are waiting for the approval,
5488,C_657cab1701bc4169adb70bf50b79def4,0,Is there an exercise room in the building?,
5489,C_657cab1701bc4169adb70bf50b79def4,1,"no but there is one a few blocks from the building, like 2 minutes",
5490,C_657cab1701bc4169adb70bf50b79def4,0,Do I have to make a deposit plus first month rent?,
5491,C_657cab1701bc4169adb70bf50b79def4,1,"yes indeed, anything else",
5492,C_657cab1701bc4169adb70bf50b79def4,0,I will pay 1900 but that is as high as I can go,
5531,C_2eda05ae7be44a5eba390ce7943aa602,1,Hello,
5532,C_2eda05ae7be44a5eba390ce7943aa602,0,"Hi, Does this unit have covered parking available.",
5533,C_2eda05ae7be44a5eba390ce7943aa602,1,"The parking is a one time fee, but your spot is permanent until you decide to move out. We do this to make sure tenants are respectable of others spaces.",
5534,C_2eda05ae7be44a5eba390ce7943aa602,0,"How much is that fee?  Are utilities included? Is cable,internet and wi-fi available?",
5535,C_2eda05ae7be44a5eba390ce7943aa602,1,"The parking fee is $50 one time. Utilities are not included, and we do not provide cable. Regarding internet and Wi-Fi, we have on site services provided, but you have the option of having your own personal internet installed on the site.",
5536,C_2eda05ae7be44a5eba390ce7943aa602,0,With the extra costs The price is a bit over my budget.  would you consider a price reduction?,
5537,C_2eda05ae7be44a5eba390ce7943aa602,1,"I am willing to go lower on the price, did you have any offers in mind?",
5538,C_2eda05ae7be44a5eba390ce7943aa602,0,How much of a deposit is required and how long a lease do you require?,
5539,C_2eda05ae7be44a5eba390ce7943aa602,1,"We require a $600 deposit, and our leasing varies between 6 months and 1 years.",
5540,C_2eda05ae7be44a5eba390ce7943aa602,0,Would you consider reduced rent for a longer term lease?,
5541,C_2eda05ae7be44a5eba390ce7943aa602,1,"Of course, we are also willing to allow you to move into one of our units that does not include the cathedral ceilings and fireplace, if you are looking to find a place that is not so pricey.",
5542,C_2eda05ae7be44a5eba390ce7943aa602,0,How much do those run?,
5543,C_2eda05ae7be44a5eba390ce7943aa602,1,We usually provide those for around the $1700 mark.,
5544,C_2eda05ae7be44a5eba390ce7943aa602,0,I am willing to do a 5 year lease with no more than a 3% increase per year at a reduced rent,
5545,C_2eda05ae7be44a5eba390ce7943aa602,1,"Unfortunately, we only provide at maximum 2 year leases. If the price is unappealing for you, give us an offer and we will see if we can match it. The apartment is very spacious, the location is in a convenient area of town, and we provide excellent safety for our residents. We try to work with new tenants on pricing, but we cannot go too low for what we provide.",
5593,C_2e12bdb4938f4cad86cde016bfe1d98d,1,"Hey, how's it going? I take it you are interested in the bike?",
5594,C_2e12bdb4938f4cad86cde016bfe1d98d,0,"Hi, it's going good. And with you? Yes, I am interested in the bike.",
5595,C_2e12bdb4938f4cad86cde016bfe1d98d,1,I'm doing good! Let me tell you this bike is a decked out Santa Cruz Chameleon Custom. You can come take it for a ride and I guarantee you will fall in love with it.,
5596,C_2e12bdb4938f4cad86cde016bfe1d98d,0,"I would like that, it is a bit of a drive for me. Can you tell me, has this bike ever been in an accident? Any marks or scratches?",
5597,C_2e12bdb4938f4cad86cde016bfe1d98d,1,Never crashed it and no marks at all. It's only about 3 months old. I'm looking to sell it for $850,
5598,C_2e12bdb4938f4cad86cde016bfe1d98d,0,"Can you tell me, are the extra set of street tires new? How much tread is on them both?",
5599,C_2e12bdb4938f4cad86cde016bfe1d98d,1,The tires on the bike are in great condition. The extra set was only used for about a week so they are basically new.,
5600,C_2e12bdb4938f4cad86cde016bfe1d98d,0,How long have you owned the bike?,
5601,C_2e12bdb4938f4cad86cde016bfe1d98d,1,3 months.,
5602,C_2e12bdb4938f4cad86cde016bfe1d98d,0,Are you the first owner? I am very interested in the bike.,
5603,C_2e12bdb4938f4cad86cde016bfe1d98d,1,I'm the only owner!,
