,Index,User,Text,Face acts
15727,C_6bd042550d784fb69a5a5d1eaf3831ff,0,"Hello, how old is  your couch?",
15728,C_6bd042550d784fb69a5a5d1eaf3831ff,1,it's a year old,
15729,C_6bd042550d784fb69a5a5d1eaf3831ff,0,cool and is it coming from a smoke and pet free home?,
15730,C_6bd042550d784fb69a5a5d1eaf3831ff,1,yes the couch is very comfortable,
15731,C_6bd042550d784fb69a5a5d1eaf3831ff,0,"Okay, one last question before we get to price. Is it an actual sofa bed or do you just have to put the pieces together like in that picture to make it a bed?",
15732,C_6bd042550d784fb69a5a5d1eaf3831ff,1,you can use for bed or couch,
15733,C_6bd042550d784fb69a5a5d1eaf3831ff,0,"Okay, so it doesn't pull out. That's cool, but the price is a bit much for me. How about $200 for it?",
15734,C_6bd042550d784fb69a5a5d1eaf3831ff,1,i will take $250 for this couch it turns into a bed is is worth every penny.,
15735,C_6bd042550d784fb69a5a5d1eaf3831ff,0,But it doesn't actually pull out into a bed. I'd have to push the pieces together which isn't what I was looking for. I'm still willing to take it off your hands though. How about $235 and I'll pick it up?,
15736,C_6bd042550d784fb69a5a5d1eaf3831ff,1,i will do the $235 if you can arrange to pick up.,
15737,C_6bd042550d784fb69a5a5d1eaf3831ff,0,okay. deal,
15738,C_62a68ddb47644c69be3e6131341fda32,0,"Hi, is the Ipad still available?",
15739,C_62a68ddb47644c69be3e6131341fda32,1,It sure is!,
15740,C_62a68ddb47644c69be3e6131341fda32,0,How many GB does this hold?,
15741,C_62a68ddb47644c69be3e6131341fda32,1,It has 64 GB of memory.,
15742,C_62a68ddb47644c69be3e6131341fda32,0,How many inches is the screen?,
15743,C_62a68ddb47644c69be3e6131341fda32,1,9.56 inches by 7.47 inches,
15744,C_62a68ddb47644c69be3e6131341fda32,0,Does it have any scratches on the screen or dents in the back?,
15745,C_62a68ddb47644c69be3e6131341fda32,1,No. It is in excellent condition!,
15746,C_62a68ddb47644c69be3e6131341fda32,0,Would you consider taking $30?,
15747,C_62a68ddb47644c69be3e6131341fda32,1,Thank you for the offer but it is too low. I need more money to buy my daughter her brithday gift.,
15748,C_62a68ddb47644c69be3e6131341fda32,0,Does it come with a case?,
15749,C_62a68ddb47644c69be3e6131341fda32,1,Unfortunately it doesn't. Would you pay $50?,
15750,C_62a68ddb47644c69be3e6131341fda32,0,I can do $50,
15751,C_6a78285a6ce24a12b0e7271f80944083,0,Hello? I'm interested in the lovely home you have rent.,
15752,C_6a78285a6ce24a12b0e7271f80944083,1,Hi!  I'm happy to hear of your interest in the property.  Do you have any questions that I can help you with?,
15753,C_6a78285a6ce24a12b0e7271f80944083,0,How much are you asking for rent?,
15754,C_6a78285a6ce24a12b0e7271f80944083,1,"It is listed at $2995, but I'm willing to work with the right tenant.",
15755,C_6a78285a6ce24a12b0e7271f80944083,0,"I'm on  a budget, and would like to go down to 1497.",
15756,C_6a78285a6ce24a12b0e7271f80944083,1,"I know what it's like to be on a budget, but $1497 is just too low.  It is recently updated and is 3 bed/1 bath.  It also includes a washer and dryer in to $2500.",
15757,C_6a78285a6ce24a12b0e7271f80944083,0,I like the idea of the washer and dryer. Are you willing to work with the deposit?,
15758,C_6a78285a6ce24a12b0e7271f80944083,1,"Yes, that is negotiable.  I'd be willing to bring the rent down to $2500/month with a deposit of half ($1250).",
15759,C_6a78285a6ce24a12b0e7271f80944083,0,Sounds great to me!. I accept the 2500.,
15760,C_6a78285a6ce24a12b0e7271f80944083,1,Excellent.  We have a deal!,
15899,C_b7820b507c2e46e0bf86dd3d218ea6c2,1,Hello! Are you interested in my wonderful land rover?,
15900,C_b7820b507c2e46e0bf86dd3d218ea6c2,0,Possibly! It looks promising from what you've listed there -- but I note that it is pretty old. A 2001 model. What kind of mileage are we talking about?,
15901,C_b7820b507c2e46e0bf86dd3d218ea6c2,1,It has 230000 miles. It is a bit old but it has a clean title and passed the smog recently. Also no scratches or dents!,
15902,C_b7820b507c2e46e0bf86dd3d218ea6c2,0,Sounds roughly par for the course. What's shaken loose after all those miles? Have there been any major repairs?,
15903,C_b7820b507c2e46e0bf86dd3d218ea6c2,1,The only thing wrong with it is a cracked windshield. Other than that tires are great and it runs amazing,
15904,C_b7820b507c2e46e0bf86dd3d218ea6c2,0,"So, being a 2001 model -- what can you tell me about its car seat compatibility?",
15905,C_b7820b507c2e46e0bf86dd3d218ea6c2,1,It has all the belt attachments on the back for car seats. We used it with all my kids and never had problems,
15906,C_b7820b507c2e46e0bf86dd3d218ea6c2,0,"Now. It does sound like it's a solid hunk of metal -- but the age of the thing does give me pause when I consider I'm going to be putting my kids into it. It's not failed yet, but I can't help but wonder when the other shoe will drop.",
15907,C_b7820b507c2e46e0bf86dd3d218ea6c2,1,The older the better! Now days all new cars are made with cheap metal that gets destroyed easily in if you crash. How about we settle for 2800?,
15908,C_b7820b507c2e46e0bf86dd3d218ea6c2,0,"Okay, good point. 2500 and we've got a deal.",
15909,C_f302bd55a31d4015adc7c5af55f4556c,0,Hi im very interested in your west elm sofa.,
15910,C_f302bd55a31d4015adc7c5af55f4556c,1,that's awesome...it's a great brand and the sofa is in like new condition,
15911,C_f302bd55a31d4015adc7c5af55f4556c,0,No pets in the house? Any spills on it?,
15912,C_f302bd55a31d4015adc7c5af55f4556c,1,it's a pet free home and no spills ...we don't have kids,
15913,C_f302bd55a31d4015adc7c5af55f4556c,0,Great! Are the measurments listed correct? I need 83.5W so if its more than that I cant buy it,
15914,C_f302bd55a31d4015adc7c5af55f4556c,1,"measurements are correct, but if you would like to measure it when you come buy it you may",
15915,C_f302bd55a31d4015adc7c5af55f4556c,0,Ok how about 375 for it?,
15916,C_f302bd55a31d4015adc7c5af55f4556c,1,im sorry that is a bit low...this sofa has a hand-built frame with hand finished upholstery,
15917,C_f302bd55a31d4015adc7c5af55f4556c,0,I don't have much to spend on it. How about 460. Thats as high as I can go,
15918,C_f302bd55a31d4015adc7c5af55f4556c,1,I really can't go that low...this brand new item would be 2x the amount that I am asking for it...how about $650 and it's yours,
15919,C_f302bd55a31d4015adc7c5af55f4556c,0,500 and you got a deal,
15920,C_f302bd55a31d4015adc7c5af55f4556c,1,I could do 525 and you come pick it up tonight,
15921,C_f302bd55a31d4015adc7c5af55f4556c,0,Ok I can do that!,
15943,C_0da95c24e7e64d7c9fc308735d6f891b,0,hey I see that you have a cool hat rack for sale...,
15944,C_0da95c24e7e64d7c9fc308735d6f891b,1,Yes its an awesome rack! Its in excellent condition for its age and its very sturdy,
15945,C_0da95c24e7e64d7c9fc308735d6f891b,0,that is awesome!! I love pieces that are different ....,
15946,C_0da95c24e7e64d7c9fc308735d6f891b,1,"You can use it to hang blankets, hats, coats, towels and even display items if its for a store. Its  brass finish is beautiful",
15947,C_0da95c24e7e64d7c9fc308735d6f891b,0,that is pretty neat Is there anything wrong with it? scratches? is it bend?...,
15948,C_0da95c24e7e64d7c9fc308735d6f891b,1,"Nothing wrong, its very sturdy and well built. No scratches that I can see",
15949,C_0da95c24e7e64d7c9fc308735d6f891b,0,that is awesome...would you be willing to consider selling it for 120?,
15950,C_0da95c24e7e64d7c9fc308735d6f891b,1,How about 150 and I deliver it?,
15951,C_0da95c24e7e64d7c9fc308735d6f891b,0,I can do $135 cash and you deliver it?,
15952,C_0da95c24e7e64d7c9fc308735d6f891b,1,135 and you pick it up,
15953,C_0da95c24e7e64d7c9fc308735d6f891b,0,I can do $135 and pick it up tonight,
15954,C_0da95c24e7e64d7c9fc308735d6f891b,1,sounds good,
16117,C_bcfeb9a3e84b4114b332bea800b68854,1,"Hi, are you interested in the place?",
16118,C_bcfeb9a3e84b4114b332bea800b68854,0,I am interested in renting the apartment listed in the ad!,
16119,C_bcfeb9a3e84b4114b332bea800b68854,1,Great. It's a 3 bedroom one bathroom the kitchen was re-done in 1997 so it's not brand new but it's in great shape,
16120,C_bcfeb9a3e84b4114b332bea800b68854,0,1997 was quite some time ago. It seems the rest of the place is great. Would there be any wiggle room with the price since the renovation was 20 years ago?,
16121,C_bcfeb9a3e84b4114b332bea800b68854,1,Well that's actually newer than the majority fo the places around since it's in a historic area.,
16122,C_bcfeb9a3e84b4114b332bea800b68854,0,"Yes, that's why I wanted to move to the neighborhood. I'm quite handy around the house and my significant other works for a general contractor. Maybe we could work out a deal where we could do some improvements ourself for a reduced rent?",
16123,C_bcfeb9a3e84b4114b332bea800b68854,1,What type of reduction did you have in mind?,
16124,C_bcfeb9a3e84b4114b332bea800b68854,0,We could pay $2000 a month and pass all upgrades through you prior to installation?,
16125,C_bcfeb9a3e84b4114b332bea800b68854,1,Deal. Just make sure we discuss any upgrades since we need to keep it pretty superficial.,
16126,C_bcfeb9a3e84b4114b332bea800b68854,0,"Absolutely. No torn down walls, just counters, appliances, and cabinets. Deal.",
16127,C_f7fffd6af4f946f0ad67de0c570788bb,0,"I love the car, are you still selling it?",
16128,C_f7fffd6af4f946f0ad67de0c570788bb,1,"Yes at a give away price of $15,000. Everything works okay just like new",
16129,C_f7fffd6af4f946f0ad67de0c570788bb,0,How many miles does she have on her?,
16130,C_f7fffd6af4f946f0ad67de0c570788bb,1,"Do not drive it all the time. I has just 75,000",
16131,C_f7fffd6af4f946f0ad67de0c570788bb,0,I was hoping to make $7500 offer on the 2005 model. What do you think?,
16132,C_f7fffd6af4f946f0ad67de0c570788bb,1,"Great but too low. Add $5000 and i can give it away at $12,500",
16133,C_f7fffd6af4f946f0ad67de0c570788bb,0,Does it hae any more perks that would make that a good deal?,
16134,C_f7fffd6af4f946f0ad67de0c570788bb,1,"Its a great care. I recently serviced it, Changed the tyres and have a brand new spare tyre. The insurance on it was just renewed too. Its a great deal i suppose",
16135,C_f7fffd6af4f946f0ad67de0c570788bb,0,Ok I will take the deal then. Thank you.,
16136,C_f7fffd6af4f946f0ad67de0c570788bb,1,Thanks,
16185,C_4d44f337afed4620b5d9b13b79708c7e,1,Hello,
16186,C_4d44f337afed4620b5d9b13b79708c7e,0,"Hello, I'm interested in the house.",
16187,C_4d44f337afed4620b5d9b13b79708c7e,1,"Great. Would you like to stop by and take a look at it? Or, do you have any questions about it?",
16188,C_4d44f337afed4620b5d9b13b79708c7e,0,I'd like to stop by and take a look but I have some questions first. Are there any bath tubs in the home or just showers?,
16189,C_4d44f337afed4620b5d9b13b79708c7e,1,There is a full bath. It has both a shower and a tub.,
16190,C_4d44f337afed4620b5d9b13b79708c7e,0,Great. Is there a laundry room?,
16191,C_4d44f337afed4620b5d9b13b79708c7e,1,yes,
16192,C_4d44f337afed4620b5d9b13b79708c7e,0,What type of yard does it have? Does it have grass or some other type of landscaping?,
16193,C_4d44f337afed4620b5d9b13b79708c7e,1,There is a yard and it is nicely landscaped with grass.,
16194,C_4d44f337afed4620b5d9b13b79708c7e,0,Great. Would you accept $3500?,
16195,C_4d44f337afed4620b5d9b13b79708c7e,1,Yes I would,
16330,C_2ca7fec7200846af84fe4200614eee9d,1,Hi are you interested in this bike?,
16331,C_2ca7fec7200846af84fe4200614eee9d,0,I like the bike.,
16332,C_2ca7fec7200846af84fe4200614eee9d,1,Are you interested in purchasing it?,
16333,C_2ca7fec7200846af84fe4200614eee9d,0,"I am interested, if the price is right.",
16334,C_2ca7fec7200846af84fe4200614eee9d,1,Well I am selling it for $45,
16335,C_2ca7fec7200846af84fe4200614eee9d,0,is that negotiable?,
16336,C_2ca7fec7200846af84fe4200614eee9d,1,I can give it to you for $40,
16337,C_2ca7fec7200846af84fe4200614eee9d,0,40 is a little high. I can come and pick it up all the way at your house if that helps.,
16338,C_2ca7fec7200846af84fe4200614eee9d,1,What price are you thinking?,
16339,C_2ca7fec7200846af84fe4200614eee9d,0,I was thinking $30,
16340,C_2ca7fec7200846af84fe4200614eee9d,1,38 is last that I can do,
16341,C_2ca7fec7200846af84fe4200614eee9d,0,36?,
16342,C_2ca7fec7200846af84fe4200614eee9d,1,okay then 36 it is,
16343,C_2ca7fec7200846af84fe4200614eee9d,0,Excellent,
16375,C_0855e5b1bdfc4c058a30a7a5bcd0e782,0,Hi how are you?,
16376,C_0855e5b1bdfc4c058a30a7a5bcd0e782,1,"Hi, I'm good thanks. How are you?",
16377,C_0855e5b1bdfc4c058a30a7a5bcd0e782,0,Very well can you tell me a little about the property?,
16378,C_0855e5b1bdfc4c058a30a7a5bcd0e782,1,"It is a beautiful condo, it was just fully remodeled. Has great big walk in closets, a huge back and side yard. Best school district.",
16379,C_0855e5b1bdfc4c058a30a7a5bcd0e782,0,That all sounds great it's just a little over my budget. Would you be willing to accept 1746 if i gave security deposit and 3 months rent upfront?,
16380,C_0855e5b1bdfc4c058a30a7a5bcd0e782,1,Well that is much lower than asking price. How long of a lease were you thinking of signing? If it were a short lease I think I could consider a price that low.,
16381,C_0855e5b1bdfc4c058a30a7a5bcd0e782,0,6 months,
16382,C_0855e5b1bdfc4c058a30a7a5bcd0e782,1,"For a 6 month lease, where you're putting up security plus 3 months I could definitely meet that price. However when that lease is up we would not be able to renew at that price.",
16383,C_0855e5b1bdfc4c058a30a7a5bcd0e782,0,That is understandable if i like the condo we can renegotiate then!,
16393,C_7679af9487b44f2dbd5b3b4cfc2f3284,1,Hello.,
16394,C_7679af9487b44f2dbd5b3b4cfc2f3284,0,Hey,
16395,C_7679af9487b44f2dbd5b3b4cfc2f3284,1,are you interested in the apartment?,
16396,C_7679af9487b44f2dbd5b3b4cfc2f3284,0,"I'm pretty interested, but I'm not sure it's worth what you're asking",
16397,C_7679af9487b44f2dbd5b3b4cfc2f3284,1,"Well the area is too good, and the apartment has been remodeled fully. I am open to negotiating though. What do you have in mind?",
16398,C_7679af9487b44f2dbd5b3b4cfc2f3284,0,"I would be willing to pay $1100 and I can offer services around the apartment, like I will do basic repairs and yardwork.",
16399,C_7679af9487b44f2dbd5b3b4cfc2f3284,1,Okay that sounds good but you will have to be working 30 hours around the apartment. Is that okay with you? to make up for the price?,
16400,C_7679af9487b44f2dbd5b3b4cfc2f3284,0,30 hours a month? sure.,
16401,C_7679af9487b44f2dbd5b3b4cfc2f3284,1,Okay then we've got a deal! Thanks,
16412,C_27ad41383ca24e1aa7b3592a8ad52c95,1,Hello,
16413,C_27ad41383ca24e1aa7b3592a8ad52c95,0,Hello? I am very interested in this home. Is the area quiet?,
16414,C_27ad41383ca24e1aa7b3592a8ad52c95,1,The area is amazing. It is very quiet and lots of families are here as well.,
16415,C_27ad41383ca24e1aa7b3592a8ad52c95,0,Is it close to any restaurants or stores?,
16416,C_27ad41383ca24e1aa7b3592a8ad52c95,1,"Yes, there is a freeway nearby that you can use to get anywhere.",
16417,C_27ad41383ca24e1aa7b3592a8ad52c95,0,I have $1375 cash right now in can bring it you right now.,
16418,C_27ad41383ca24e1aa7b3592a8ad52c95,1,"That is pretty low. Can you afford a bit more, like 2400?",
16419,C_27ad41383ca24e1aa7b3592a8ad52c95,0,Yes can we meet up right now?,
16420,C_27ad41383ca24e1aa7b3592a8ad52c95,1,"Sure, I can. Is that price okay with you?",
16421,C_27ad41383ca24e1aa7b3592a8ad52c95,0,Yes that price will work for me.,
16422,C_27ad41383ca24e1aa7b3592a8ad52c95,1,Awesome. Thanks a lot,
16444,C_cf7a097564eb4728aacd78e7794de3ca,0,Is there any scratches on this?,
16445,C_cf7a097564eb4728aacd78e7794de3ca,1,No scratches or marks. It is in great shape.,
16446,C_cf7a097564eb4728aacd78e7794de3ca,0,Do you know how old it is?,
16447,C_cf7a097564eb4728aacd78e7794de3ca,1,About two and a half years. There were no pets or smoking in the home.,
16448,C_cf7a097564eb4728aacd78e7794de3ca,0,Any wiggle room on the price?,
16449,C_cf7a097564eb4728aacd78e7794de3ca,1,I can go a little bit lower. Would $75 be acceptable?,
16450,C_cf7a097564eb4728aacd78e7794de3ca,0,I was looking for more towards 60,
16451,C_cf7a097564eb4728aacd78e7794de3ca,1,Would you be interested in $68 if I throw in a wooden DVD storage unit with the same finish?,
16452,C_cf7a097564eb4728aacd78e7794de3ca,0,Yes actually I would love that!,
16453,C_cf7a097564eb4728aacd78e7794de3ca,1,Sounds great. Thank you for your time and patience.,
16478,C_da1a86d78e4f4f68b1f17c3054f4bce8,0,Hey there,
16479,C_da1a86d78e4f4f68b1f17c3054f4bce8,1,Hello. Are you interested in this item>,
16480,C_da1a86d78e4f4f68b1f17c3054f4bce8,0,Yeah I am. How used is it?,
16481,C_da1a86d78e4f4f68b1f17c3054f4bce8,1,Its 2 years old. I haven't used it the past 2 years,
16482,C_da1a86d78e4f4f68b1f17c3054f4bce8,0,Are the wheels in good shape.,
16483,C_da1a86d78e4f4f68b1f17c3054f4bce8,1,Yes absolutely they're perfect,
16484,C_da1a86d78e4f4f68b1f17c3054f4bce8,0,"I have cash and if I come pick it up today, will you take 2700.00 or I will give you $3000 if you deliver it.",
16485,C_da1a86d78e4f4f68b1f17c3054f4bce8,1,well i will take the 2700 as delivering myself would be too much work for me.,
16486,C_da1a86d78e4f4f68b1f17c3054f4bce8,0,"Perfect, I will come pick it up today.",
16496,C_31432cfc8c5c4015a28f51f6ebc4e002,0,"Hi, I'm interested in your phone.",
16497,C_31432cfc8c5c4015a28f51f6ebc4e002,1,Hi! It's in great condition and is fully unlocked.,
16498,C_31432cfc8c5c4015a28f51f6ebc4e002,0,The image is a little dark. Is it ivory or is it white? It says you have had it in the box since you bought it. Are there any scratches on the face though?,
16499,C_31432cfc8c5c4015a28f51f6ebc4e002,1,"It's white. Nope, not a single scratch, it's just like new. It's been in the otterbox case for the entire time. I also just bought new headphones and wall charger for it.",
16500,C_31432cfc8c5c4015a28f51f6ebc4e002,0,Is there also a screen protector on it?,
16501,C_31432cfc8c5c4015a28f51f6ebc4e002,1,"There was, yes. I took the case and protector off while trying to sell the phone, since both of them kind of wore off over the years.",
16502,C_31432cfc8c5c4015a28f51f6ebc4e002,0,Would you willing to part with it for $90?,
16503,C_31432cfc8c5c4015a28f51f6ebc4e002,1,"If you pay for the shipping, it's all your for $90. What do you say?",
16504,C_31432cfc8c5c4015a28f51f6ebc4e002,0,Deal,
16533,C_3f6852e56e1f4935a74323f2a87cad08,1,Hello.,
16534,C_3f6852e56e1f4935a74323f2a87cad08,0,"Hi, I would like to purchase your Maple Desk.",
16535,C_3f6852e56e1f4935a74323f2a87cad08,1,Great! It's in excellent condition and has a wonderful surface now that it has been re-finished.,
16536,C_3f6852e56e1f4935a74323f2a87cad08,0,That's great. It sounds like something that would fit nicely in my home.,
16537,C_3f6852e56e1f4935a74323f2a87cad08,1,"Oh, good. Is $40 a good price for you?",
16538,C_3f6852e56e1f4935a74323f2a87cad08,0,"Honestly, I was looking spend more around $36.",
16539,C_3f6852e56e1f4935a74323f2a87cad08,1,I do have a matching chair for the desk that I'm also selling. Could you do $40 if I were to sell them to you together as a set?,
16540,C_3f6852e56e1f4935a74323f2a87cad08,0,Would you be willing to deliver them to me?,
16541,C_3f6852e56e1f4935a74323f2a87cad08,1,"Sure, as long as you're available after 4:00pm.",
16542,C_3f6852e56e1f4935a74323f2a87cad08,0,I get off work at 5:00pm. Would around 5:30 work?,
16543,C_3f6852e56e1f4935a74323f2a87cad08,1,"Yes, that time would be fine.",
16544,C_3f6852e56e1f4935a74323f2a87cad08,0,Great. Sounds good. Thank you.,
16627,C_ec2f233e9228469f9f80cb7c141613e5,1,HI! what do you think about the bike?,
16628,C_ec2f233e9228469f9f80cb7c141613e5,0,I like it...just saw it.,
16629,C_ec2f233e9228469f9f80cb7c141613e5,1,"the bike is in an excellent condition, I am even including 2 pair of tires, thin and thick tires, would you like to make an offer?",
16630,C_ec2f233e9228469f9f80cb7c141613e5,0,"I see the wheelset is 2 months old, but how old is the bike? Do you know?",
16631,C_ec2f233e9228469f9f80cb7c141613e5,1,6 months old,
16632,C_ec2f233e9228469f9f80cb7c141613e5,0,Can you deliver it to me?,
16633,C_ec2f233e9228469f9f80cb7c141613e5,1,"I sure can, it includes free shipping",
16634,C_ec2f233e9228469f9f80cb7c141613e5,0,"Excellent! Are you willing to come down on the price at all? I'd love to buy it, but the price is a bit high for me.",
16635,C_ec2f233e9228469f9f80cb7c141613e5,1,"I understand, how much do you have in mind?",
16636,C_ec2f233e9228469f9f80cb7c141613e5,0,"Well, I'd could do cash for sure...and I'm just gonna offer and we'll go from there...would you be willing to take $400? Maybe I can do some landscaping for you to work off the rest. Or, my wife owns a salon, she can take care of haircuts for you and your family for a few months.",
16637,C_ec2f233e9228469f9f80cb7c141613e5,1,"the less that I could take is $650, but I do have a very large yard, if you are willing to do some landscaping at my house my final offer would be $600",
16692,C_337f4af47d0c4ebfad527f4d879b1ea3,0,hello i saw the ad for you apartment!,
16693,C_337f4af47d0c4ebfad527f4d879b1ea3,1,Hi. Are you interested? Can I answer any questions for you?,
16694,C_337f4af47d0c4ebfad527f4d879b1ea3,0,"Yes it is beautiful, but i have one small problem",
16695,C_337f4af47d0c4ebfad527f4d879b1ea3,1,Yes. What is your problem?,
16696,C_337f4af47d0c4ebfad527f4d879b1ea3,0,I cant not afford the $2250,
16697,C_337f4af47d0c4ebfad527f4d879b1ea3,1,What is your price range?,
16698,C_337f4af47d0c4ebfad527f4d879b1ea3,0,i can afford 1125 a month,
16699,C_337f4af47d0c4ebfad527f4d879b1ea3,1,"That is a little lower then I can go. I can go $2000 and I will fully furnish and can fully furnish it with included utilities. Water, Electric, and Internet Access.",
16700,C_337f4af47d0c4ebfad527f4d879b1ea3,0,thats a little higher than i wanted to go but if you cant work with the pricing I guess we can settle,
16768,C_983a1c824bb943b6b60cfba10df8d498,1,Hello,
16769,C_983a1c824bb943b6b60cfba10df8d498,0,Hi Great to find a 200GB sd card. I have been looking out to have it. Does it mean its suitable for all Android phone?,
16770,C_983a1c824bb943b6b60cfba10df8d498,1,Yes I believe so.,
16771,C_983a1c824bb943b6b60cfba10df8d498,0,Thats great. Can i have it for $40?,
16772,C_983a1c824bb943b6b60cfba10df8d498,1,The MicroSD card is brand new in an unopened package. I could not go much lower than the list price.,
16773,C_983a1c824bb943b6b60cfba10df8d498,0,Will you be willing to accept a cash payment of $60?,
16774,C_983a1c824bb943b6b60cfba10df8d498,1,The item is brand new and this item sells for much more than I am asking on amazon.,
16775,C_983a1c824bb943b6b60cfba10df8d498,0,Wow. That good to hear. Will you go $65 last price for me.,
16776,C_983a1c824bb943b6b60cfba10df8d498,1,I'm sorry but you haven't really given any reason to justify a reduced price.,
16777,C_3e4a2b1addbe45d19f51228834da02cd,1,HI are you interested in my Theatre seating they are barely used.,
16778,C_3e4a2b1addbe45d19f51228834da02cd,0,Hi. How are you?,
16779,C_3e4a2b1addbe45d19f51228834da02cd,0,Yes I am. What kind of condition are they in? Smoke free/pet free home? Any scuffs or tearing in the leather?,
16780,C_3e4a2b1addbe45d19f51228834da02cd,1,"I am fine. These would make a great set for you if you are looking for theatre seating, they are barely used, we purchased adn decided on different color scheme",
16781,C_3e4a2b1addbe45d19f51228834da02cd,0,Ok. Are they pretty heavy duty?,
16782,C_3e4a2b1addbe45d19f51228834da02cd,1,They are pet and smoke free home and yes they are very heavy and sturdy piece of furniture they should last a very long time,
16783,C_3e4a2b1addbe45d19f51228834da02cd,0,How old are they?,
16784,C_3e4a2b1addbe45d19f51228834da02cd,1,We bought them less than 6 months ago but after getting them didn't like them in our color scheme we were choosing so they were not used but a couple times,
16785,C_3e4a2b1addbe45d19f51228834da02cd,0,"Perfect. I am def interested. I have $1630, cash in hand, if I could come pick up today!",
16786,C_3e4a2b1addbe45d19f51228834da02cd,1,That sounds great if you can come today that would be awesome.,
16787,C_3e4a2b1addbe45d19f51228834da02cd,0,Awesome. Thank you!,
16788,C_8e072d1f86614ff48d74a8ed9c91ad5f,1,Hello. Thanks for viewing the listing.,
16789,C_8e072d1f86614ff48d74a8ed9c91ad5f,0,Was the desk recently refinished and is it light or dark?,
16790,C_8e072d1f86614ff48d74a8ed9c91ad5f,1,It was refinished last year.,
16791,C_8e072d1f86614ff48d74a8ed9c91ad5f,0,Thanks I meant When Light or dark?,
16792,C_8e072d1f86614ff48d74a8ed9c91ad5f,1,Sorry. It's a dark maple.,
16793,C_8e072d1f86614ff48d74a8ed9c91ad5f,0,Oh I kind of needed light Because my room is so small.,
16794,C_8e072d1f86614ff48d74a8ed9c91ad5f,1,"I have it listed for $40, but since you needed light, please let me know what you're willing to pay for the one I have.",
16795,C_8e072d1f86614ff48d74a8ed9c91ad5f,0,Is there anyway you could take $15? I know It's not much but I am on a fixed income and really need a desk',
16796,C_8e072d1f86614ff48d74a8ed9c91ad5f,1,Can you do $20 and I'll deliver it to you?,
16797,C_8e072d1f86614ff48d74a8ed9c91ad5f,0,Yes I could pay $20. It would help me for you to deliver it I'll make you a pie.,
16798,C_8e072d1f86614ff48d74a8ed9c91ad5f,1,Sounds great!,
16883,C_579cde3684cd47718c7fdbd63ef81ba9,0,"Hello, I'm interested in your product, what all is included with the accessories?",
16884,C_579cde3684cd47718c7fdbd63ef81ba9,1,"All wires necesary for connection to your receiver, HDMI cable, Fiber line, power cord.",
16885,C_579cde3684cd47718c7fdbd63ef81ba9,0,"Great! your price is a little high for me, would you be able to give me a deal?",
16886,C_579cde3684cd47718c7fdbd63ef81ba9,1,"brand new, this item sells for 1200 from bestbuy. This unit is not used very much and in incredibly good condition.",
16887,C_579cde3684cd47718c7fdbd63ef81ba9,0,"I know, I can't afford it anywhere else which is why I'm looking on here. I have a turntable I could trade you as well if that would allow you to accept a lower price",
